title,job_title,pros,cons,recommendation,salary,date,location,career_opportunity_rating,work_life_balance_rating,work_env_rating,management_rating,benefits_rating,diversity_rating,overall_rating,company
‘I cant there is too many emotions’,RN,The staff are lovely and caring and good people. Still friends with most of the people i worked with.,Staff to patient/ resident  load but its similar or higher in most  other age care,Recommends working here: Yes,Rates salary as: Average,2 years ago,"Rangeville, Queensland, Australia",4.0,3.0,4.0,4.0,3.0,4.0,4.0,Bupa Wellness
‘A disappointment’,General Manager,Caring for the elderly,Listening to the Bupa values and knowing the company doesn’t live by them,Recommends working here: No,Rates salary as: Average,2 years ago,"NSW, Australia",2.0,2.0,3.0,1.0,2.0,1.0,1.0,Bupa Wellness
‘Great ppl to work with’,Treasury Accountant,Recognised world wide,Internal communications,Recommends working here: Yes,Rates salary as: Average,4 years ago,"Sydney, New South Wales, Australia",2.0,4.0,4.0,2.0,3.0,2.0,3.0,Bupa Wellness
‘Low pay but a great job.’,Client Partnership,Fun and enjoyable work,Being recognised by managers who aren't interested,Recommends working here: Yes,Rates salary as: Low,4 years ago,"Melbourne, Victoria, Australia",3.0,4.0,3.0,2.0,3.0,4.0,3.0,Bupa Wellness
‘I have ups and downs and sadness’,AIN Carer,The people you work with different nationalities,Difficult residents some are very challenging at times they all have different needs and wants,Recommends working here: Yes,Rates salary as: Average,3 years ago,Tamworth,4.0,3.0,4.0,3.0,3.0,3.0,3.0,Bupa Wellness
‘You need to play politics to survive.’,Digital Marketing Manager,SYDNEY OFFICE LOCATED IN A GREAT SPOT IN THE CITY.,Senior marketing management very political and not very smart.,Recommends working here: No,Rates salary as: High,4 years ago,"Sydney, New South Wales, Australia",2.0,2.0,1.0,1.0,2.0,1.0,1.0,Bupa Wellness
‘Overall great company and place to work if you have a decent manager’,Sales Manager,Great staff benefits and employee rewards programs,"Senior management very clicky, only promote friends rather then performing employees",Recommends working here: Yes,Rates salary as: Average,4 years ago,"Brisbane, Queensland, Australia",4.0,3.0,2.0,1.0,4.0,3.0,3.0,Bupa Wellness
‘I have learnt a lot but I'm always looking for a new opportunity’,Senior Sales Consultant,Lots of diversity and benefits for employees,Not enough room for movement as WA is a small team. It's harder to progress.  Plus the salaries should be higher for what you are expected to do.,Recommends working here: No,Rates salary as: Low,4 years ago,"Perth, Western Australia, Australia",2.0,4.0,4.0,2.0,4.0,4.0,3.0,Bupa Wellness
‘To achieve  a goal’,Personal Care Worker,"Well managed , friendly  environment.","Team work , time management.",Recommends working here: Yes,Rates salary as: Average,3 years ago,thomastown,4.0,4.0,4.0,4.0,4.0,4.0,3.0,Bupa Wellness
‘The role was very junior than what it was made out to be’,Team Assistant,Most people were friendly,"Not having a proper job deescription, support or training provided",Recommends working here: No,Rates salary as: Average,4 years ago,"Perth, Western Australia, Australia",2.0,3.0,2.0,2.0,2.0,2.0,3.0,Bupa Wellness
‘Cost cutting takes over care provision’,Registered Nurse Division 1,Residents and care staff,No communication from management or appreciation,Recommends working here: No,Rates salary as: Average,2 years ago,"NSW, Australia",2.0,1.0,3.0,1.0,1.0,1.0,2.0,Bupa Wellness
‘Thought it would be the best but turned out the worst.’,Various,Some of the heart working staff and our service users,"Under staffing
Training is minimal or non existent 
Company values don't match practices.",Recommends working here: No,Rates salary as: Average,2 years ago,"Melbourne VIC, Australia",3.0,2.0,1.0,1.0,1.0,4.0,1.0,Bupa Wellness
‘Glad I’ve left’,AIN,Great residents and great care staff from the originals,"Communication with management 
Always short staffed
Ratios, no handover",Recommends working here: No,Rates salary as: Low,1 year ago,"Tugun QLD, Australia",4.0,3.0,3.0,1.0,2.0,2.0,2.0,Bupa Wellness
‘It has its pros and cons’,Supervisor,Residents and co workers,Getting staff to work extra or obtaining staff due to work loads when short,Recommends working here: No,Rates salary as: High,1 year ago,"Portland VIC, Australia",3.0,3.0,2.0,2.0,1.0,3.0,3.0,Bupa Wellness
‘A very friendly working environment.’,Assistant In Nursing,Employee benefits and recognition for promotions,Time is precious and coming on time is very important.Make sure advise your manager in advance if you can't make it to work.,Recommends working here: Yes,Rates salary as: Average,2 years ago,"Ballarat VIC, Australia",5.0,5.0,5.0,5.0,5.0,5.0,5.0,Bupa Wellness
‘Good for those who doesn’t want career development.’,Non-clinic,Bupa follows the EBA. Working hours are negotiable to fit your work life balance.,Work politics have no evidence.,Recommends working here: No,Rates salary as: Average,1 year ago,"Melbourne VIC, Australia",3.0,4.0,3.0,2.0,4.0,3.0,3.0,Bupa Wellness
‘I am happy to work there’,AIN,Sensitive management,Low salary rate and showy people domination,Recommends working here: Yes,Rates salary as: Low,3 years ago,sydney,5.0,5.0,5.0,5.0,4.0,5.0,5.0,Bupa Wellness
‘An absolute headache and burnt out’,Sales Consultant,You can take days off whenever you feel like it,Nothing is ever good enough no matter how well you do - Stay away from this company,Recommends working here: No,Rates salary as: Low,2 years ago,"Melbourne VIC, Australia",1.0,1.0,1.0,1.0,1.0,1.0,1.0,Bupa Wellness
‘Glad to be out of there.’,Claims Analyst,Lots of morning teas,"Complicated processes and poor management on rewards, recognition or penalties",Recommends working here: No,Rates salary as: Low,4 years ago,"Brisbane, Queensland, Australia",1.0,1.0,1.0,1.0,3.0,3.0,1.0,Bupa Wellness
‘Great’,Sales Coach,Great team great commradery,Staff turnover and lack of experience,Recommends working here: Yes,Rates salary as: Average,4 years ago,"Perth, Western Australia, Australia",5.0,4.0,4.0,4.0,5.0,5.0,1.0,Bupa Wellness
‘Stressful’,Customer Service Representative,Co workers & employee benefits for health cover,Middle management have no care about their employees were just a number that makes them money,Recommends working here: No,Rates salary as: Average,2 years ago,"Melbourne VIC, Australia",3.0,5.0,4.0,2.0,3.0,5.0,2.0,Bupa Wellness
"‘It's a good company to work at in general, however there are some limitations in certain part of the business.’",Health Coach,Working with great people,Constant pressure to keep up with KPI and lack of diversity,Recommends working here: Yes,Rates salary as: Average,4 years ago,"Melbourne, Victoria, Australia",4.0,4.0,5.0,3.0,4.0,4.0,4.0,Bupa Wellness
‘I had a poor experience due to pressures to do things outside of policy guidelines’,Finance,There were good benefits particularly around health insurance,Management pressure employees to do things outside of their own policies. When challenged this is very much frowned upon.,Recommends working here: No,Rates salary as: Average,4 years ago,"Melbourne, Victoria, Australia",2.0,3.0,1.0,1.0,4.0,3.0,1.0,Bupa Wellness
‘Never been treated as unprofessionally anywhere EVER’,Information Technology,Good people at lower levels,Nepotism and cronyism is rife,Recommends working here: No,Rates salary as: Average,3 years ago,Melbourne,1.0,3.0,3.0,1.0,4.0,1.0,1.0,Bupa Wellness
‘Work & life balance’,Compensation Damages Advisor,Work life balance insurance discount,Opportunity to move up,Recommends working here: Yes,Rates salary as: Average,4 years ago,,4.0,5.0,4.0,4.0,4.0,4.0,4.0,Bupa Wellness
"‘Yes for a stable job, but no room for development’",Optical Dispenser,"Average pay, good customer base","It's not a fair roster to work with, management won't do much about it even they know the problems",Recommends working here: No,Rates salary as: Average,2 years ago,"Chatswood, New South Wales, Australia",1.0,3.0,3.0,2.0,3.0,1.0,1.0,Bupa Wellness
‘Great place to work if you have no ambition and another source of income.’,Call Centre Consultant,"Happy environment, good facilities, good team leaders.",Making ends meet on the poor salary offered,Recommends working here: No,Rates salary as: Low,2 years ago,"Brisbane City, Queensland, Australia",2.0,1.0,4.0,4.0,3.0,4.0,3.0,Bupa Wellness
‘Experience taught me to keep going no matter what’,Accounts Payable Officer,Always had something to do,Remembering which technique works with what task,Recommends working here: Yes,Rates salary as: High,2 years ago,"Melbourne, Victoria, Australia",5.0,5.0,5.0,5.0,5.0,5.0,5.0,Bupa Wellness
‘Good workplace. Not a very good management.’,RN,"Liked my workmates. The place is nice, good equipments.",Poor communication between employees and management,Recommends working here: No,Rates salary as: Low,2 years ago,"Baulkham Hills NSW, Australia",2.0,3.0,4.0,1.0,1.0,1.0,2.0,Bupa Wellness
‘Loved working there but top management not approachable.’,Care Manager,The training and chance for promotion is highly recommended,"Top management, privacy and confidentiality was very poor.",Recommends working here: No,Rates salary as: Average,2 years ago,"Ballarat, Victoria, Australia",4.0,2.0,3.0,2.0,3.0,3.0,4.0,Bupa Wellness
‘I love working for bupa’,PCA,The residents that what makes me wanting to go to work,Working with peers not enough team work,Recommends working here: Yes,Rates salary as: Average,3 years ago,Bonbeach,4.0,3.0,3.0,3.0,3.0,3.0,5.0,Bupa Wellness
‘Fulfilling career path’,Manager,Bupa offers great employee programs to help you grow and develop,"Targets are reasonable, but like any job there is pressure to achieve.",Recommends working here: Yes,Rates salary as: Average,2 years ago,"NSW, Australia",5.0,4.0,4.0,4.0,4.0,4.0,4.0,Bupa Wellness
‘The place to work’,Database Developer,"Convenient location, friendly environment, flexible work hours.",A lot of new projects.,Recommends working here: Yes,Rates salary as: Average,4 years ago,"Melbourne CBD, Victoria, Australia",4.0,5.0,5.0,5.0,5.0,5.0,5.0,Bupa Wellness
‘Quite fortunate and happy to work at Bupa’,Specialist,"Open and flexible environment, fair growth opportunities",The organisation is too big and can sometimes slow down simple things.,Recommends working here: Yes,Rates salary as: Average,2 years ago,"Melbourne, Victoria, Australia",3.0,5.0,4.0,4.0,4.0,4.0,5.0,Bupa Wellness
‘Overall good place for working than I other company's’,AIN,Flexible work/life balance,Somehow to enough shifts for all staff,Recommends working here: Yes,Rates salary as: Average,2 years ago,"Sydney NSW, Australia",5.0,5.0,5.0,3.0,3.0,5.0,5.0,Bupa Wellness
‘AIN for BUPA’,AIN,The residents are so amazing to work with.,The other AINs aren't so nice all the time.,Recommends working here: Yes,Rates salary as: Low,4 years ago,,3.0,3.0,3.0,3.0,3.0,3.0,5.0,Bupa Wellness
‘Easy going’,Head Gardener,Meeting new people and getting to know the residents.,Trying to satisfy everyone,Recommends working here: Yes,Rates salary as: Average,2 years ago,"Baulkham Hills, New South Wales, Australia",4.0,4.0,4.0,4.0,3.0,4.0,5.0,Bupa Wellness
"‘Good place, great work environment, money could be better’",Catering Manager,"Work life balance, staff around me","Heavy workload, change over of staff.",Recommends working here: Yes,Rates salary as: Average,2 years ago,"ACT, Australia",3.0,4.0,4.0,4.0,3.0,3.0,3.0,Bupa Wellness
‘Nice’,Carer,"Safe and friendly environment, people centred, great duty_merits training programs...",More organized in front line: team leaders' training on job allocating,Recommends working here: Yes,Rates salary as: Average,2 years ago,"NSW, Australia",4.0,5.0,5.0,4.0,4.0,5.0,5.0,Bupa Wellness
‘Find something else’,Retention,Good opportunity to move around,Management were not helpful or caring. Targets were unrealistic,Recommends working here: No,Rates salary as: Average,2 years ago,"Brisbane City, Queensland, Australia",3.0,2.0,2.0,1.0,3.0,4.0,1.0,Bupa Wellness
‘Eye opening’,AIN My Hourly Wage Is $22.48 An Hour,Usually working with people of similar mindset.  Satisfaction that your making a difference in someone's life.  (Aged Care),"Lack of staff due to poor pay, staff usually have two jobs, Bupa gets second place due to low wage and heavy work load on your shift.  
Management only see the $$$ and the profit, not interested in 'person first' or how hard it is on the floor.",Recommends working here: No,Rates salary as: Low,2 years ago,"Cairns City, Queensland, Australia",3.0,4.0,3.0,2.0,2.0,2.0,3.0,Bupa Wellness
‘Needs to find a healthier work environment’,Marketing Manager,Salary was competitive,"Clarity of roles across the organisation
Leadership quality and strength
Legacy systems",Recommends working here: No,Rates salary as: Average,2 years ago,"Melbourne, Victoria, Australia",2.0,3.0,2.0,2.0,2.0,2.0,2.0,Bupa Wellness
‘Decrease my passion towork in agedcare’,RN,Plenty shifts available,Short staff poor hand over,Recommends working here: No,Rates salary as: Low,2 years ago,"Canberra, ACT, Australia",3.0,1.0,1.0,1.0,1.0,1.0,3.0,Bupa Wellness
‘Tiring and lacking of focus’,Marketing,"Focus on health 
Nice office 
Invest in health",Politics and too many chiefs,Recommends working here: No,Rates salary as: Average,4 years ago,"Melbourne, Victoria, Australia",4.0,2.0,1.0,1.0,2.0,1.0,1.0,Bupa Wellness
‘Not great for someone with a life’,Customer Service Representative,Some of the people were fantastic.,The management was disappointing. Incompetent. The changes to shifts so rapidly with constant late shifts was ridiculous as they wouldn't allow swaps/changes,Recommends working here: No,Rates salary as: Low,2 years ago,"Melbourne, Victoria, Australia",1.0,1.0,3.0,1.0,3.0,2.0,2.0,Bupa Wellness
"‘Overall it's a good company to work for, but it's not as good as it used to be.’",Mobile Sales Specialist,"Rewards you with financial benefits if you hit your monthly KPIs, you get 50% off of your health insurance (it does save you a lot of money) Great products and employee benefits.","- Sales target is constantly raising each year
- Monthly target is unrealistic to achieve with the current economic cycle.  
-They only care about your sales figures, they literally treat people like numbers. 
- Career development is a joke. Interview for internal vacancies could drain you dry.",Recommends working here: No,Rates salary as: Average,4 years ago,"Brisbane, Queensland, Australia",1.0,4.0,3.0,2.0,4.0,1.0,2.0,Bupa Wellness
‘Really enjoyed my stay’,BI Developer,Very flexible work place,Complex reporting environment,Recommends working here: Yes,Rates salary as: High,2 years ago,"Sydney NSW, Australia",4.0,5.0,5.0,4.0,4.0,5.0,5.0,Bupa Wellness
"‘A very good company to work for , excellent communication .’",Assistant In Nursing,Education and updated certificate are available,The challenges are working in the  dementia ward understaffed.,Recommends working here: Yes,Rates salary as: Average,4 years ago,"Pottsville, New South Wales, Australia",5.0,5.0,4.0,5.0,4.0,5.0,5.0,Bupa Wellness
"‘Met some great people, but middle management need some work.’",Project Coordinator,Great perks and discounts provided for employees. Great company values.,Middle management does nothing to look after staff and morale is low in certain departments.,Recommends working here: No,Rates salary as: Average,1 year ago,"Melbourne VIC, Australia",3.0,5.0,1.0,1.0,5.0,5.0,3.0,Bupa Wellness
‘Fairly nice place to work for but very political’,Enterprise Project Management Office,Fairly mature project management processes in place. Using project server can be considered a plus. Good teamwork activities.,Very political environment. Not enough support provided by management. In particular my role was set for failure as it was driving change in project management with little support from management.,Recommends working here: Yes,Rates salary as: Low,2 years ago,"Melbourne VIC, Australia",3.0,5.0,2.0,2.0,0.0,4.0,3.0,Bupa Wellness
‘Much much better place to work’,Health Coach With Bupa Telehealth,"Manager change for my team has resumed its long gone stressful environment and is now more flexible and relaxed as it used to be. 
Starting at 10 am not earlier, and having breaks when I choose to have them.",Dealing with uncomfortable situations like rostered on taking inbound calls but setting own challenges and trying new tbings. Keeping up with KPIs day to day.,Recommends working here: Yes,Rates salary as: Average,2 years ago,"Melbourne VIC, Australia",3.0,4.0,4.0,4.0,3.0,4.0,4.0,Bupa Wellness
"‘Just great, like a family with lots of perks and career variety’","Customer Care Consultant, Inbound Calls",Fresh fruit and barista on site( free) and free newspapers. Great location. Friendly. Career opportunities.,Contract to start( temp) but full time role recruitment exists too. Hardest thing is getting in the door ina popular organization.,Recommends working here: Yes,Rates salary as: High,4 years ago,"Brisbane, Queensland, Australia",5.0,5.0,5.0,4.0,5.0,4.0,5.0,Bupa Wellness
"‘At this time, I would not recommend Bupa to my friends.’",Nurse,"Friendly staff but poor management,","Before when I first started, I love working here. Has a good team and good support from the management, Now most of the RN/EN are unhappy because of the workload. This company has a recent changes that for me is very unsafe or might not satisfied the needs of residents. Short staffing. RN on the floor reduced. More loads for the RN and EN. Low salary.",Recommends working here: No,Rates salary as: Low,1 year ago,"Waratah NSW, Australia",3.0,3.0,3.0,2.0,2.0,3.0,3.0,Bupa Wellness
‘Claim to be resident focused however their focus is more directed toward profit over care. Expectation of staff is over and above paid hours.’,General Manager,The residents and their families are always a privilege to know and learn from.,Several - hours required to undertake the role were far in excess of paid hours. On call 24/7. Minimal staffing. Minimal support.,Recommends working here: No,Rates salary as: Average,4 years ago,,2.0,1.0,2.0,1.0,3.0,2.0,1.0,Bupa Wellness
"‘A very interesting job, always somewhere different, keeps the work varied.’",Registered Nurse,"The best thing about Bupa Wellness, is that I get to travel all over Australia, work for different companies everyday, and meet new people.","Not having permanent hours, but this may change, as I'm getting enough hours, except over January.",Recommends working here: Yes,Rates salary as: Average,2 years ago,Adelaide,4.0,4.0,4.0,4.0,5.0,4.0,4.0,Bupa Wellness
‘A great place to come to every day to work due to the great people who work here.’,Claims Assessor,"A great team and very wonderful people. Very high moral and great managment.
I loved working at Bupa.",You learn new skills all the time and build your knowledge which is great but means you need to have the same KPI for more work load. However as someone who loves to be challenged I found it great.,Recommends working here: Yes,Rates salary as: Average,2 years ago,"Adelaide, South Australia, Australia",3.0,5.0,5.0,5.0,4.0,5.0,5.0,Bupa Wellness
‘Interested in sales not service’,Sales & Service Consultant,It was enjoyable being able to help customers & give them great customer service,They say that they care about customers but they are only interested in getting new members not keeping & assisting existing customers.  Some supervisors do not treat staff fairly.,Recommends working here: No,Rates salary as: Low,3 years ago,Queensland,3.0,3.0,3.0,2.0,3.0,2.0,3.0,Bupa Wellness
"‘Overall, a very good workplace to work in’",Customer Service Representative,"Strong team and good management staff members operate through most of the branches. Carousel, Garden City and Joondalup branches have outstanding branch managers","Downturn in the economy has made it harder to hit targets. Also started during a period where it was understaffed, creating a lot of challenges",Recommends working here: Yes,Rates salary as: Average,2 years ago,"Cannington, Western Australia, Australia",3.0,4.0,5.0,5.0,5.0,5.0,5.0,Bupa Wellness
‘A great place to be  - a career can be built here.’,People Team,"The career opportunities are great, but you need to do the work to earn it. People complain about not having developmnet opportunities 'given' to them. The work environment is fab. The leadership team are excellent and the people overall are very friendly and accepting.","Its such a big complex organisation, it can feel a bit like turning a ship to get things done. But it's worth it.",Recommends working here: Yes,Rates salary as: Average,2 years ago,"Melbourne, Victoria, Australia",5.0,4.0,5.0,5.0,4.0,5.0,5.0,Bupa Wellness
"‘If your looking for work/life balance, keep looking.’",Customer Service Rep,"- Benifits and Discounts
- Peer to peer rewards system
- Onsite Batista
- Fruit drops twice a week
- The co-workers make it easier to be there everyday
- Monday til Friday work","- Next to no work/life balance at all.
-  You cannot apply for leave in March or July
-  Aweful rosters
-  Late shifts almost every 2nd or 3rd week.
-  Lack of communication at times
-  Leaders scoulds centre at times
-  So many workplace secrets
-  HR team extremely hard to get hold of, no contact numbers
-  Unrealistic KPIs.
-  Things that need attention, dont get looked into.
-  Things that don't need attention, gets looked into or changed.
-  Staff feedback survey, just to make staff feel like they get some feedback, but this isn't the case.",Recommends working here: No,Rates salary as: Low,1 year ago,"Brisbane City QLD, Australia",2.0,1.0,2.0,1.0,4.0,3.0,2.0,Bupa Wellness
‘Have been a very happy employee. Lots of opportunities for people to grow and develop.’,Functional Transformation Program Manager,Excellent company culture,Demolishing the silos,Recommends working here: Yes,Rates salary as: Average,3 years ago,Melbourne,4.0,5.0,5.0,4.0,4.0,5.0,5.0,Bupa Wellness
"‘Great team environment, poor pay, poor management’",Dental Assistant,"Friendly Colleagues, good location",Management is poor - not willing to help or encourage what so ever.,Recommends working here: No,Rates salary as: Low,2 years ago,"Morphett Vale, South Australia, Australia",1.0,3.0,3.0,1.0,3.0,5.0,2.0,Bupa Wellness
‘I'm waiting until some new roll is advertised to change.’,Reception,We receive a box of fruits every Monday for the staff.,The roll is really repetitive.,Recommends working here: Yes,Rates salary as: Average,4 years ago,"Brisbane, Queensland, Australia",3.0,4.0,3.0,3.0,4.0,5.0,4.0,Bupa Wellness
‘Good work environment overall’,Registered Nurse Division 1,Friendly and supportive staff,"Wages, loss of acute clinical skills",Recommends working here: Yes,Rates salary as: Low,2 years ago,"QLD, Australia",4.0,4.0,4.0,4.0,3.0,3.0,4.0,Bupa Wellness
‘Disillusionment with the big blue box’,Head Office,Great location; modern office,While the organisation promotes their values these are not upholded or practiced by the management team. This fostered a climate of uncertainty and fear where job security and promotion was based on internal politics not skills,Recommends working here: No,Rates salary as: Average,2 years ago,"Sydney NSW, Australia",2.0,3.0,2.0,1.0,3.0,3.0,1.0,Bupa Wellness
‘A huge learning experience.’,Assistant In Nursing,"Great people, diverse cultures, very understanding of university students.",Driving to and from work (40mins to and 40mins from),Recommends working here: Yes,Rates salary as: Average,2 years ago,"Canberra, Stirling, Australian Capital Territory, Australia",5.0,5.0,5.0,4.0,4.0,5.0,5.0,Bupa Wellness
‘Would never go back’,RN,"Good working team 
residents are beautiful",Horrible place to work,Recommends working here: No,Rates salary as: Low,2 years ago,"Cairns City, Queensland, Australia",1.0,1.0,1.0,1.0,1.0,1.0,1.0,Bupa Wellness
‘Lack of Clinical Governance’,Therapy,The residents we care for are the only thing that makes my day at work.,Working for a company that is hipcritical about their care for their residents,Recommends working here: No,Rates salary as: Low,2 years ago,"Sutherland, New South Wales, Australia",1.0,3.0,2.0,1.0,2.0,1.0,2.0,Bupa Wellness
"‘Understaffed, unnapreciated & disrespected’",AIN,"Rostering system, pay day",Working understaffed & with poor quality staff,Recommends working here: No,Rates salary as: Low,2 years ago,Berry,1.0,1.0,1.0,1.0,1.0,1.0,1.0,Bupa Wellness
‘Good learning but no opportunity to grow’,N/A,People are treated well,No property systems or structure,Recommends working here: No,Rates salary as: Average,2 years ago,"Sydney, New South Wales, Australia",2.0,2.0,3.0,2.0,2.0,5.0,3.0,Bupa Wellness
‘Great Workplace’,AIN/DT,"Great Staff and Residents, Great Community with Great Communication skills.",Different Residents may make things abit Challenging for their care.,Recommends working here: Yes,Rates salary as: Average,3 years ago,Toowoomba Rangeville,3.0,4.0,4.0,4.0,4.0,4.0,4.0,Bupa Wellness
‘Restricted in career development’,Credit Control Officer,Flexibility with work hours,Career progression was a road block,Recommends working here: No,Rates salary as: Average,2 years ago,"Sydney, New South Wales, Australia",2.0,3.0,3.0,3.0,3.0,3.0,3.0,Bupa Wellness
