title,job_title,pros,cons,recommendation,salary,date,location,career_opportunity_rating,work_life_balance_rating,work_env_rating,management_rating,benefits_rating,diversity_rating,overall_rating,company
"‘Great experience, would have preferred to stay but, was not prepared to move to Melb’",Qld HR Manager,"Bupa are very good at managing change for their people.  Know how to take them on the journey & show genuine concern when people are struggling with any change.  Their staff medical insurance is great, especially if you have children.",The main challenge is that the majority of the senior roles are in Melb.,Recommends working here: Yes,Rates salary as: High,4 years ago,"Brisbane, Queensland, Australia",3.0,4.0,5.0,4.0,5.0,3.0,4.0,Bupa Wellness
‘Regretful.’,Project Manager,Location. Some nice people work there but are outnumbered by policital players.,"Trying to implement change in a toxic, hostile, incompetent environment.",Recommends working here: No,Rates salary as: Low,4 years ago,"Melbourne, Victoria, Australia",1.0,3.0,1.0,1.0,1.0,2.0,1.0,Bupa Wellness
"‘Ridiculous workloads for staff, always understaffed. No continuity of care for residents, very sad and disheartening to see.’",Business Administrator,Nursing and care staff are hardworking.,"Understaffed, staff are overwhelmed with huge workloads. The Bupa values are not adhered too by anyone, especially management.
I struggled to believe in the product i was asked to be selling.",Recommends working here: No,Rates salary as: Average,1 year ago,"Sydney NSW, Australia",1.0,1.0,1.0,1.0,1.0,1.0,1.0,Bupa Wellness
‘Dont work there!’,Catering Assistant,None. Not a nice place to work.,"Bosses, money, shifts",Recommends working here: No,Rates salary as: Low,2 years ago,"Rangeville QLD, Australia",1.0,1.0,1.0,1.0,1.0,1.0,1.0,Bupa Wellness
‘Amaizing’,Front Office Receptionist,"Good environment, good people, everybody respect you and you can feel that you have a family there. I love Bupa.",If you learn quickly you wil improve your career there,Recommends working here: Yes,Rates salary as: Average,2 years ago,"Melbourne, Victoria, Australia",5.0,5.0,5.0,5.0,5.0,5.0,5.0,Bupa Wellness
‘Great place to work’,Catering Assistant,Good people to work with,The work can be challenging at times,Recommends working here: Yes,Rates salary as: Low,4 years ago,,3.0,4.0,5.0,3.0,2.0,5.0,5.0,Bupa Wellness
‘Challenging role but learnt a lot’,Retention Customer Care,The discounts and benefits,The targets and some people I worked with,Recommends working here: No,Rates salary as: Average,4 years ago,"Hawthorn, Victoria, Australia",3.0,3.0,5.0,1.0,5.0,3.0,3.0,Bupa Wellness
‘My expectations weren’t met.’,Customer Service Rep,Bupa overall provides great services.,It is a very who you know environment to move up in development. Lack of growth support.,Recommends working here: No,Rates salary as: Average,2 years ago,"Melbourne, Victoria, Australia",2.0,1.0,1.0,3.0,1.0,1.0,3.0,Bupa Wellness
‘I enjoyed working for a company with good values’,Division 1 Registered Nurse,Working for such a big company gives you more career progression,"For me it wasn't a role I wanted to continue on, I wanted to veer my career in a different path.",Recommends working here: Yes,Rates salary as: Average,4 years ago,"Hawthorn, Victoria, Australia",4.0,4.0,4.0,4.0,4.0,5.0,4.0,Bupa Wellness
‘I am really don't want to advice to work in bupa aged care i don't about it's other different work-field.’,AIN,Nothing good about bupa aged care.,Management is terrible,Recommends working here: No,Rates salary as: Low,4 years ago,Nsw,2.0,2.0,2.0,1.0,2.0,1.0,2.0,Bupa Wellness
‘Lack of support from management and understaffed’,Community Nurse,Residents and family's,Bad communication with management,Recommends working here: No,Rates salary as: Low,2 years ago,"Traralgon, Victoria, Australia",2.0,3.0,1.0,1.0,2.0,2.0,1.0,Bupa Wellness
‘Great culture with supportive management’,Business Transaction Officer,"Great  communication from the management re how well
The company is performing financially n changes within the company",Companies operate in different ststem,Recommends working here: Yes,Rates salary as: High,4 years ago,"Melbourne, Victoria, Australia",5.0,5.0,4.0,4.0,5.0,5.0,5.0,Bupa Wellness
‘I was given great challenging work and a friendly environment which is what I was looking for in an employer.’,Customer Service Business Analyst,"Friendly people, great culture, good  work/life balance",Provided limited formal training. Mostly on the job or compliance related.,Recommends working here: Yes,Rates salary as: Average,4 years ago,"Melbourne, Victoria, Australia",3.0,4.0,4.0,3.0,4.0,4.0,4.0,Bupa Wellness
"‘Good experience,’",Kitchen Hand,Good staff training and guidance,"Time management ,paper works",Recommends working here: Yes,Rates salary as: Average,2 years ago,"Woodville South, South Australia, Australia",5.0,4.0,4.0,5.0,4.0,5.0,5.0,Bupa Wellness
"‘Would never go back, bupa looks great from the outside but is terrible on the inside. Low pay and no understanding, consideration or problem solving from management.’",AIN,"New facility, modern, person centred care.",Extremely understaffed for months on end making it impossible to deliver reasonable care to residents. Management that would not listen to complaints let alone help with a solution. No where near the amount of equipment needed for adequate time management of a shift and often being expected to use equipment alone. The pay rate for what your expected to do is pathetic. I have worked in other facilities and they all have things that can be improved but nothing in comparison to bupa in my opinion.,Recommends working here: No,Rates salary as: Low,2 years ago,"Cairns City QLD, Australia",4.0,2.0,1.0,1.0,3.0,3.0,1.0,Bupa Wellness
‘Perfect balance or work and home life working for Bupa’,Business Administrator,"Great recruitment process which really fits the people to their role. 
Also great employee benefits","Nothing really. Aged care is a great industry, and Bupa is leading the way",Recommends working here: Yes,Rates salary as: High,4 years ago,"Runaway Bay, Queensland, Australia",5.0,5.0,5.0,5.0,5.0,5.0,5.0,Bupa Wellness
"‘No recognition for actual workers, just political players.’",IT Systems Engineer,Reasonably flexible business hours. Some working from home.,"Too much weekend work. Everything needs to be done yesterday. Politics interferes with work on a daily basis. Management want to be agile because its the in thing and, therefore, nothing is planned or implemented properly",Recommends working here: No,Rates salary as: Average,2 years ago,"Melbourne, Victoria, Australia",2.0,3.0,2.0,2.0,2.0,2.0,2.0,Bupa Wellness
‘Hated it big mistake joining the company’,Store Manager,Can't think of anything,Having to work under staffed all the time,Recommends working here: No,Rates salary as: Average,4 years ago,"Melbourne, Victoria, Australia",2.0,1.0,1.0,1.0,4.0,2.0,1.0,Bupa Wellness
"‘My experience to date has been fantastic, it is great to work for a company who truly recognises potential in their employees and will do everything to support that potential’",Corporate Account Manager,"Supportive work environment
Work/life balance
Truly cares about their employees",WA is just a small part of a much larger business,Recommends working here: Yes,Rates salary as: High,2 years ago,,5.0,5.0,5.0,5.0,5.0,5.0,5.0,Bupa Wellness
"‘I loved my time at Bupa, the only downside was that many of the career oportunities were Melbourne based.’",Digital Marketing Specialist,"Good culture, care about staff, genuinely believe in their mission.","Political, long approval processes, Melbourne based head office can leave Sydney staff out of the loop.",Recommends working here: Yes,Rates salary as: Average,1 year ago,"Sydney NSW, Australia",2.0,4.0,4.0,3.0,4.0,5.0,3.0,Bupa Wellness
‘Great growth and experience but limited on innovation and encouraging strong leaders.’,Clinical Service,They mean we’ll but have trouble executing.,Mostly old school and traditional in approach and initiatives.,Recommends working here: No,Rates salary as: Average,2 years ago,"Sydney NSW, Australia",3.0,3.0,3.0,1.0,2.0,2.0,2.0,Bupa Wellness
‘I have an emotional relationship with my company BUPA. I love to work at BUPA.’,Enterprise Application Support Manager,"Culture, opportunities, people, values",Process related challenges which causes some small issues but the executive people are very keen and open to resolve these issues.,Recommends working here: Yes,Rates salary as: Average,3 years ago,"Melbourne, Victoria, Australia",5.0,5.0,5.0,5.0,5.0,5.0,5.0,Bupa Wellness
‘Good memories and experience but could have been great!’,Sales And Service Consultant,"Nice teams, nice stores to work in, small benefits like getting treats/fruit baskets from head office during busy periods",Taking leaves is a bit tricky in sales. Internal movement is tough.,Recommends working here: Yes,Rates salary as: Low,1 year ago,"Melbourne VIC, Australia",3.0,3.0,4.0,3.0,3.0,4.0,3.0,Bupa Wellness
‘Average’,Clinical Manager,Opportunities for career,Heavy workload at time without overtime pay,Recommends working here: No,Rates salary as: Average,2 years ago,"Victoria, Australia",3.0,2.0,3.0,1.0,2.0,3.0,3.0,Bupa Wellness
"‘Management do not look after there staff , loyalty to staff is low , there is no encouragement or reward for work that is done’",Nurse,Nice residents who deserve good care,Management do not look after staff and staff ratios have been severely affected of late,Recommends working here: No,Rates salary as: Low,1 year ago,"Berry NSW, Australia",3.0,3.0,3.0,2.0,1.0,3.0,3.0,Bupa Wellness
"‘It's ok, but need improvement’",Health Support Officer,The people are great! my colleagues are the best part of the job!,"The growth in the company is shocking. Was promised when starting the role that the growth was great but every opportunity I've had has either been taken away or has been \""cancelled\""",Recommends working here: No,Rates salary as: Average,2 years ago,"Melbourne VIC, Australia",1.0,5.0,4.0,2.0,5.0,5.0,3.0,Bupa Wellness
"‘Should have done it earlier in my life and although it was not the rewarding financially, it was personally the most satisfying job I had ever done.’",Personal Care Assistant/ AIN,The fun times with the residents,Frequent under staffing,Recommends working here: Yes,Rates salary as: Average,2 years ago,"Ballina, New South Wales, Australia",4.0,5.0,4.0,3.0,3.0,4.0,4.0,Bupa Wellness
‘Average’,Senior Customer Service Officer,Was great when it was mbf really cared about the customers. You get discount in health insurance,"All bupa  ares about now is sell sell sell, health car travel income protection, with little regard of the customer, i ended up leaving due to the pressure of having a manager stand behind you at certain times, asking why you didnt try to sell the customer more insurance",Recommends working here: No,Rates salary as: Average,4 years ago,"Gold Coast, Queensland, Australia",2.0,3.0,2.0,1.0,3.0,2.0,2.0,Bupa Wellness
‘Non caring about their staff who go above and beyond.’,AIN,The wonderful elderly residents. And most work colleagues.,No clear direction from management or support.,Recommends working here: No,Rates salary as: Low,2 years ago,"Gold Coast, Queensland, Australia",2.0,2.0,3.0,1.0,1.0,3.0,1.0,Bupa Wellness
‘Love everything about bupa’,Ain And Gso,There are caring staff throw out the nursing home i have been there for 2yrs and love it wouldn't work anywhere else,Every day is a challenge,Recommends working here: Yes,Rates salary as: Average,2 years ago,"NSW, Australia",5.0,5.0,5.0,5.0,5.0,5.0,5.0,Bupa Wellness
‘Bupa looks after everyone’,Store Manager,"Great culture, great people that had a passion and desire to help customers","Sales target are high and due to the economic climate, it is a tough market",Recommends working here: Yes,Rates salary as: Average,2 years ago,"Melbourne, Victoria, Australia",4.0,4.0,4.0,4.0,4.0,4.0,5.0,Bupa Wellness
‘Exhausting’,Customer Service Consultant.,"Free coffee, free fruit, the occasional game to break the monotony.",Zero work life balance if you don't live close to work. Extremely hard to find childcare when your hours are constantly changing.,Recommends working here: No,Rates salary as: Average,4 years ago,"Brisbane, Queensland, Australia",3.0,1.0,3.0,3.0,3.0,3.0,3.0,Bupa Wellness
‘The most embarrassingly low paid job for what you have to know and do.   Horrendous management up to state level.  Scarred for life’,Retail Sales And Service,"Discounts ,some great people you meet and helping people","Management,  targets,  staffing levels,  work loads.",Recommends working here: No,Rates salary as: Low,2 years ago,"South Australia, Australia",1.0,1.0,1.0,1.0,3.0,3.0,1.0,Bupa Wellness
‘Felt like progression within Bupa wasn't realistic.’,Inbound Insurance Salesmen,Close by public transport.,Standing out from a huge crowd of staff.,Recommends working here: Yes,Rates salary as: Average,4 years ago,"Melbourne, Victoria, Australia",3.0,4.0,4.0,4.0,3.0,3.0,4.0,Bupa Wellness
‘Worst job I ever had overall as an RN. Looking for anything better.’,Registered Nurse,Some staff and most of the residents.,"Low morale, 3 managers in 4 months, little to no support from other RN’s, unrealistic workload if you want to do your job properly and deliver good care. One RN for 50 residents and you’re expected to finish everything on day shift. Expected to work back for free daily with no appreciation. Docked pay for being a minute late.",Recommends working here: No,Rates salary as: Average,1 year ago,"Bateau Bay NSW, Australia",2.0,3.0,2.0,1.0,1.0,3.0,2.0,Bupa Wellness
‘Rewarding’,AIN,Friends,No challenges,Recommends working here: Yes,Rates salary as: Average,4 years ago,"Pottsville, New South Wales, Australia",5.0,5.0,4.0,4.0,3.0,4.0,5.0,Bupa Wellness
‘Fantastic customer service skills many years of sales experience’,Service & Sales Consultant,If you work hard Bupa reward you very well the recognition is fantastic,I work in a remote area so relief staff is a real issue sometimes we are working alone and this can be a real challenge,Recommends working here: Yes,Rates salary as: High,4 years ago,"Albury, New South Wales, Australia",5.0,3.0,5.0,3.0,4.0,5.0,5.0,Bupa Wellness
‘Very diverse and varied’,Health Support Consultant,Bupa provides you with all the on the job training required. Also the additional benefit of an employee discount for your health insurance and other insurance policies,Day to day work can be mundane,Recommends working here: Yes,Rates salary as: Average,2 years ago,"Brisbane, Queensland, Australia",4.0,4.0,5.0,4.0,5.0,5.0,4.0,Bupa Wellness
"‘Good workers,poor management’",AIN,Had some good people to work with,Under staffed a lot - still expecting staff to do everything making it very stressful- couple times a week.,Recommends working here: No,Rates salary as: Average,2 years ago,"Tugun QLD, Australia",3.0,2.0,3.0,2.0,2.0,3.0,3.0,Bupa Wellness
‘Made my anxiety got sky high stress leave’,AIN,Break times when we got them,"Work load, short staff, expectations in short time, management always changing",Recommends working here: No,Rates salary as: Low,2 years ago,"Wodonga, Victoria, Australia",1.0,1.0,1.0,1.0,2.0,2.0,1.0,Bupa Wellness
‘No understanding.’,Optical Dispenser,Some nice staff members.,Bad management. Nasty manager.,Recommends working here: No,Rates salary as: Low,4 years ago,,1.0,1.0,1.0,1.0,1.0,1.0,1.0,Bupa Wellness
‘Supportive but overly collaborative’,Senior PM,"Inclusion, cultural awareness","Red tape, lack of clean decision making",Recommends working here: Yes,Rates salary as: Average,2 years ago,"Melbourne, Victoria, Australia",4.0,3.0,3.0,1.0,1.0,3.0,5.0,Bupa Wellness
"‘Bupa looks great from the outside but once I was inside I was let down by the internal tools, processes and management support to perform my role effectively’",Market Analytics Manager,Excellent head office working environment and great Customer focus,"Let down by poor internal systems, broken internal processes and lack of management strategy",Recommends working here: No,Rates salary as: Average,4 years ago,"Melbourne, Victoria, Australia",1.0,3.0,5.0,1.0,3.0,3.0,1.0,Bupa Wellness
"‘Short staffed, low pay and dreadful environment’",Assistant In Nursing,The residents are lovely!,Management have no idea on cares for clients,Recommends working here: No,Rates salary as: Low,1 year ago,"Pottsville NSW, Australia",1.0,1.0,1.0,1.0,1.0,1.0,1.0,Bupa Wellness
‘Hated it would never work there again or put loved ones in there’,Assistant In Nursing,Nothing good at all. You are just a number under staff very poor management,Doing your work on time an finished before you leave to bad you are under staff working on your own with 30 ederly people with broken equipment,Recommends working here: No,Rates salary as: Low,2 years ago,"Tugun QLD, Australia",1.0,1.0,1.0,1.0,1.0,1.0,2.0,Bupa Wellness
‘Hard work pays off’,Specialist Consultant,Great career opportunites,Need to start at the bottom and be patient,Recommends working here: Yes,Rates salary as: High,4 years ago,"Brisbane, Queensland, Australia",4.0,3.0,3.0,4.0,4.0,4.0,4.0,Bupa Wellness
‘Would not recommend to anyone’,Legal,The discount on health insurance,Closed and manipulative executive,Recommends working here: No,Rates salary as: Low,4 years ago,"Melbourne, Victoria, Australia",1.0,1.0,1.0,1.0,1.0,1.0,1.0,Bupa Wellness
‘Toxic enviroment to work and very unexperienced managemnet’,Analytics Manager,"Big company, system in place lots of data and lots of nice people","Bureaucracy, slow processes and convoluted.",Recommends working here: No,Rates salary as: Average,2 years ago,"Sydney, New South Wales, Australia",1.0,1.0,2.0,1.0,1.0,1.0,1.0,Bupa Wellness
‘They dont really care about their staff it is all about money’,Lifestyle Assistant,The good things was getting to talk to interesting residents who came to stay at bupa,Getting staff to change their ways to make residents who live there have quality of life,Recommends working here: No,Rates salary as: Low,2 years ago,"Kyneton, Victoria, Australia",3.0,4.0,3.0,4.0,1.0,3.0,3.0,Bupa Wellness
‘Very supportive when things go bad outside of work’,Customer Service Officer,The perks with health cover were amazing,Call centre work can be mentally taxing,Recommends working here: Yes,Rates salary as: High,2 years ago,"Brisbane City, Queensland, Australia",3.0,3.0,4.0,3.0,4.0,3.0,4.0,Bupa Wellness
‘Worst workplace I've ever been at’,CR AGENT,Discount for health insurance,"Low commissions considering the work put in, terrible management and people in the office",Recommends working here: No,Rates salary as: Low,2 years ago,"Victoria, Australia",1.0,1.0,1.0,1.0,4.0,1.0,1.0,Bupa Wellness
‘Second worst job I have ever had’,Sales Role,"Nice workers, hours ok, 
","Terrible management, micromanagement, very low pay, terrible culture, ",Recommends working here: No,Rates salary as: Low,2 months ago,"Melbourne City, VIC, Australia",1.0,3.0,1.0,1.0,1.0,2.0,1.0,Bupa Wellness
"‘Great work, poor leadership ’",Senior People And Culture Consultant,"Great team
Diverse project workload
Established brand","Unprofessional and chaotic Executive Leadership, particularly in Digital/Marketing
Organisation is too fat at the mid/top end, huge waste of customer money",Recommends working here: No,Rates salary as: Low,3 months ago,"Melbourne VIC, Australia",3.0,3.0,1.0,1.0,1.0,3.0,2.0,Bupa Wellness
‘Fun place to work’,Proactive Consultant,Ethical and fun culture,The remuneration  is not the nest but there are alot of opportunities for advancement,Recommends working here: Yes,Rates salary as: Low,2 years ago,"Brisbane City, Queensland, Australia",4.0,4.0,4.0,4.0,4.0,5.0,3.0,Bupa Wellness
‘A learning experience that I hope not to repeat’,Information Services,There were opportunities for exposure to different aspects of my role that supported some career growth,The environment (IT) is somewhat toxic and plagued by indecision. Salaries are below market.,Recommends working here: No,Rates salary as: Low,2 months ago,"Melbourne VIC, Australia",2.0,2.0,1.0,1.0,1.0,1.0,1.0,Bupa Wellness
"‘It was very monitored, always being monitored.’",Not Providing,"My morning breaks, my lunch breaks and my afternoon breaks.",Adhering to the strict monitoring on time.,Recommends working here: No,Rates salary as: Average,2 months ago,"Brisbane QLD, Australia",3.0,1.0,1.0,4.0,2.0,3.0,1.0,Bupa Wellness
‘Bad experience!!’,N/A,Subsidise private health insurance ,Extremely poor management!,Recommends working here: No,Rates salary as: Average,2 months ago,"Western Australia, Australia",1.0,1.0,1.0,1.0,1.0,1.0,1.0,Bupa Wellness
‘Avoid at all costs’,Transformation Manager,Can't think of anything.,"Management in fighting, vicious blame culture, poor work environment, terrible staff discounts",Recommends working here: No,Rates salary as: Average,2 years ago,"Melbourne, Victoria, Australia",3.0,2.0,1.0,1.0,1.0,3.0,1.0,Bupa Wellness
‘Great experience’,General Services Manager,Learning experiences.,Timing and coming to terms with rules applied.,Recommends working here: Yes,Rates salary as: Average,3 years ago,"Eden, New South Wales, Australia",3.0,4.0,4.0,3.0,4.0,3.0,4.0,Bupa Wellness
‘Wost company’,AIN,The residence that live there,To get you work done,Recommends working here: No,Rates salary as: Low,4 years ago,"Pottsville, New South Wales, Australia",2.0,1.0,1.0,1.0,1.0,1.0,1.0,Bupa Wellness
‘Not ideal’,PCW,The residents are mostly very nice,"Management, nurses that speak to other staff poorly and again management!",Recommends working here: No,Rates salary as: Low,2 years ago,"Victoria, Australia",3.0,1.0,1.0,2.0,2.0,1.0,2.0,Bupa Wellness
"‘Ok, but bad pay compared to other aged care places.’",Business Administrator,Nothing outstanding just an average place to work.  It is what you make it.,Management merry go rounds.  Poor pay.  Say that their policy is that people love working at Bupa but not a reality.,Recommends working here: Yes,Rates salary as: Low,2 years ago,"Sydney, New South Wales, Australia",3.0,3.0,3.0,2.0,1.0,3.0,3.0,Bupa Wellness
‘Life changing’,Carer,Looking after our residents,There are many but all good,Recommends working here: Yes,Rates salary as: Average,4 years ago,"Tumut, New South Wales, Australia",5.0,5.0,5.0,5.0,5.0,5.0,5.0,Bupa Wellness
"‘Stressful, they gave me a tremendous amount of grief during my time their.’",Customer Service Rep,"Nothing - I would never, ever work for them again.","One toilet brake a day for  five minutes, beware you will be timed!
Then you will need to explain why you took so long.
If you talk to a customer for too long you will need to explain why, management are uncaring and stats focused, they do not care about staff only themselves and how much money they can make.",Recommends working here: No,Rates salary as: Low,1 year ago,"Sydney NSW, Australia",1.0,1.0,1.0,1.0,1.0,2.0,1.0,Bupa Wellness
‘Too high expectations without proper training program.’,Sales Consultant,Close to train station.,Training is very poor.,Recommends working here: No,Rates salary as: Average,2 years ago,"Sydney NSW, Australia",2.0,2.0,1.0,1.0,4.0,3.0,1.0,Bupa Wellness
‘Poor’,Customer Growth,????????????????????,Executive Leadership,Recommends working here: No,Rates salary as: Low,2 years ago,"Brisbane, Queensland, Australia",2.0,1.0,1.0,1.0,2.0,1.0,1.0,Bupa Wellness
"‘Wonderful delightful place to work, kept fully informed of changes’",Sales Consultant,Peers,Hours in a day,Recommends working here: Yes,Rates salary as: High,4 years ago,,5.0,5.0,5.0,5.0,5.0,5.0,5.0,Bupa Wellness
‘Vr’,Very Good Organization,Friendly staff,Different place good job....,Recommends working here: No,Rates salary as: High,4 years ago,"Adelaide, South Australia, Australia",5.0,5.0,5.0,5.0,5.0,5.0,5.0,Bupa Wellness
‘The workload is hectic and challenging. I love what I do and the gratitude from residents and loved ones make it worthwhile.’,AIN,Teaches you how to work with limited staff and to prioritise your work under pressure. Good and supportive team from other staff.,Extremely short staffed. 7-9:1 resident to staff ration in the morning depending on site. No support from management at all. Not flexible or supportive for any carer development. Staff not valued. Management more concerned about making money than the staff or quality of care to residents.,Recommends working here: No,Rates salary as: Low,1 year ago,"Canberra ACT, Australia",2.0,2.0,2.0,2.0,2.0,4.0,3.0,Bupa Wellness
