title,job_title,pros,cons,recommendation,salary,date,location,career_opportunity_rating,work_life_balance_rating,work_env_rating,management_rating,benefits_rating,diversity_rating,overall_rating,company
‘The money and people are great.’,Claims Specialist,"The culture is the biggest selling point for Suncorp, they had a competitive contractor rate and had a really great maxi term contract available for staff.","Poor shift rostering, management had little idea of what they were doing, nothing was black or white which made insurance claims fun to say the least.",Recommends working here: Yes,Rates salary as: High,1 year ago,"Newcastle NSW, Australia",1.0,2.0,4.0,2.0,4.0,4.0,3.0,Suncorp
‘Been here too long now and need to move on to better things.’,Banking Specialist,"Work Life Balance is pretty much all Suncorp has going for it's employees now. Especially since they started \""hot desking\""and \""work from home\"". Work from home days are the best days that I work as I don't have to deal with Management and can just do my job without being micro managed all day.",Micro Management. Leadership. Lack of development opportunities unless you are one of the faves! You get told they want you to be in the running for senior roles but then get shown the exact opposite. Equality just isn't there as much as they say it is.,Recommends working here: No,Rates salary as: Average,6 months ago,"Brisbane QLD, Australia",1.0,4.0,3.0,1.0,3.0,1.0,3.0,Suncorp
"‘Great Culture of people, I love working here’",Training Consultant,"The culture of the people is amazing; the people are happy and enjoying working there. The  work/life balance is brilliant, they are considerate and always flexible.",I find all 'business as usual' challenges can be worked out and discussed very well. There may be too many management levels can be hard to grasp!,Recommends working here: Yes,Rates salary as: Average,2 years ago,"Sydney, New South Wales, Australia",3.0,5.0,5.0,4.0,4.0,5.0,5.0,Suncorp
‘Consider looking elsewhere for real progressive career development. ’,Risk Adviser,Work life balance. Bonus is pretty much a given as long as you do your day job. Bonus structure flat so no need to work too hard. ,Management are hopeless. Never seen money wasted so efficiently as a result of failed governance. Career progression is difficult because the restructuring fails to remove the least productive employees. ,Recommends working here: No,Rates salary as: Average,1 year ago,"Sydney NSW, Australia",1.0,5.0,3.0,2.0,3.0,1.0,2.0,Suncorp
‘Used to be a good place to work but has recently lost its way.’,Account Manager,Flexible workplace arrangements - Agile but instead of large silos there are now thousands of people working independently creating workplace issues as the business is trying to slash its Real Estate operating costs.,Top line revenue is way down forcing the company to slash its 2 biggest costs - Staff & Claims to try & maintain its profit position.  Many budgets have been cut to the point where its almost impossible for some areas to function & management focusing on what can be cut next to artificially prop up short term shareholder returns.  Many decisions are being made for short term profits that will have a significant long term cost that will be hard to recover.  Lots of experienced staff talent leaving the business for greener pastures - look elsewhere for long term career progression.,Recommends working here: No,Rates salary as: Low,1 year ago,"Sydney NSW, Australia",1.0,1.0,3.0,1.0,3.0,3.0,2.0,Suncorp
"‘Positive, happy, didn't want to leave!’",Administration Assistant,"Great work culture! Happy, positive, flexible...speaking to others...they agree...not micro managed, great office- ergonomic, lunch yoga...",None-was on a short term assignment so none. Maybe if I stayed longer something...overall a great experience. Happy staff is noticed so obviously management are doing something right!,Recommends working here: Yes,Rates salary as: High,2 years ago,"Barangaroo, New South Wales, Australia",3.0,5.0,5.0,5.0,5.0,5.0,5.0,Suncorp
"‘A very professional company that treat staff very well, and reward hard work.’",Claims Assist Consultant,Very good company to work for. They do things by the book and make sure that everything is done fairly. The training you receive is fantastic and the amount of support you have is unmeasurable.,"There is monotony in the job, however that is to be expected with a lot of jobs. The company itself though doesn't face any challenges and it's a very friendly environment.",Recommends working here: Yes,Rates salary as: Average,4 years ago,"Brisbane, Queensland, Australia",4.0,5.0,5.0,5.0,5.0,5.0,5.0,Suncorp
"‘Apart from the team leader,  it's great place to work. Senior management seems very friendly to staff.’",Senior Financial Accountant,"Great location. encourage work life balance with loads of staff benefits, discount insurance policy etc.",Still have lots of incompetent people as it's very large organisation. Depends on your own boss. my boss wasn't good enough. lack of technical knowledge but manage a high risk area require deep understanding of technical knowledge.,Recommends working here: Yes,Rates salary as: Average,3 years ago,Brisbane,4.0,4.0,4.0,3.0,4.0,4.0,4.0,Suncorp
"‘A great company, means well but a little lost at present.’",Architect,"Well meaning, would be a fantastic place if you're happy to go with the flow and not wanting to pursue your own achievements and ideas.",Very hierarchical. Have overdone the Agile culture - great stuff but little capability left for any thoughtful design. So many things being delivered and few people have any idea how it'll come together. Managing perception gets you places not dealing with reality.,Recommends working here: No,Rates salary as: Average,3 years ago,Brisbane,4.0,2.0,4.0,2.0,4.0,2.0,2.0,Suncorp
‘Absolutely soul destroying and a massive waste of my time.’,Claims Adviser,Some of my colleagues ,"The expectation of high volume of work compared to the staff ratio.
But nothing compares to the toxic work environment I experienced. Team leaders who were not leaders, in that no support was offered to support the team when asked.
Leaders would leave a struggling team and enjoy an extended lunch of 2-3 hours. If staff were late but from lunch it was noted.
I could not get out of Suncrap quick enough, the worst place I have ever worked.",Recommends working here: No,Rates salary as: Average,6 months ago,"NSW, Australia",2.0,2.0,1.0,1.0,1.0,2.0,2.0,Suncorp
"‘Great company but...Although a great company, which strives to be innovative due to its large growth’",Client Manager,"Work life balance, opportunity to work from home. A company in which is innovative and is constantly changing with new ideas.","Constant changes and restuctures, job security is sometimes questionable. Large growth h",Recommends working here: Yes,Rates salary as: Average,4 years ago,"Sydney, New South Wales, Australia",3.0,5.0,4.0,3.0,3.0,4.0,4.0,Suncorp
"‘Working in this Financial Service Industry, Suncorp had given me full skills and qualification to achieve my goal as an accomplished superannuation professional over the years of experienced gained in an administration sector.’",Fund Administrator,"The work environment where every staff is given the opportunities to excel, it also includes honest communications. I love where everyone full and credible team mates utilizing their unique talents and abilities.","That learning new skills for the benefits of the company, but I find it interesting and motivating and see many challenges that lie ahead for personal advancement.",Recommends working here: Yes,Rates salary as: Average,4 years ago,"Sydney, New South Wales, Australia",3.0,5.0,5.0,5.0,4.0,5.0,5.0,Suncorp
‘Fantastic company to work for’,Claims Processing Officer,"High emphasis on ensuring staff are well trained, team atmosphere, focus on work/life balance. Great involvement from all levels of management and lower level recommendations listened to implemented","Varying hours,",Recommends working here: Yes,Rates salary as: Average,4 years ago,"Toowoomba, Queensland, Australia",5.0,5.0,5.0,5.0,4.0,5.0,5.0,Suncorp
"‘I had great time , enjoyed the job, until area lending managers made the job unpleasant with poor people skills’",Lending Manager,"Great  Banking staff , team enviroment, ,great products , pride in the company across brands,i believe insurance brand is an absolute stand out,  with my personal interactions with claims , great customers ,","Some lower level management with poor people skills, wages, communication with management, system constraints, decision making timelines too long, competition creates urgency thus back office staff needed to be rostered to longer hours to gain customers, older suncorp customers are loyal, suncorp needs to convert/service  the newer customers to this loyality",Recommends working here: Yes,Rates salary as: Average,4 years ago,"Brisbane, Queensland, Australia",4.0,3.0,3.0,2.0,3.0,4.0,4.0,Suncorp
"‘Suncorp is the place that will shape you, teach you, and mold you into the best person you can be.’",Change Lead,Suncorp is definitely the place to go to for job security and if you are looking to start somewhere and really grow. I found that Suncorp truly molded me into the type of person/manager I am today. My five years at Suncorp were the most valuable years.,Honestly no challenges. Perhaps what may seem a challenge is that once you get in Suncorp it can be hard to get out - and not in a bad way... only because the decision to move on is so difficult due to Suncorp being such a truly great place to work.,Recommends working here: Yes,Rates salary as: High,4 years ago,"Melbourne, Victoria, Australia",5.0,5.0,5.0,4.0,5.0,5.0,5.0,Suncorp
"‘No training, no career path, no mentoring,no leaders,no vision, no heart,no soul, no direction, boys club’",Senior Relationship Manager,"Great Products, Great front line staff, terrible back office head office support and out sourcing os has been a disaster for customer experience",They need to close 75% of branches and make more larger financial hubs. Stop trying to be all things for every product market and focus on the things you are good at and can create scale and volume and offer value.  Your home lending product department have not created a truly new product in over 10 years.  Trying to win back retail insurance customers who left because of price at renewal rather then reward these clients upfront with loyalty discounts. Youi approach may work as a suncorp quote takes just as long as a youi one.  Suncorp had a good story to tell after the floods in Qld but dropped the message that quality insurance is priceless.,Recommends working here: No,Rates salary as: Average,4 years ago,Brisbane Gold Coast,1.0,1.0,4.0,1.0,2.0,3.0,1.0,Suncorp
‘I have been with Suncorp for nearly 15 years now and wouldn't be anywhere else’,Assessing And Repair Manager Technical And Training,"Suncorp is like one big family, The culture is great and Suncorp understand the importance of their staff  to it's success. Suncorp have a lot of \""Real People\"" in manager which makes it easy to talk to them and voice any concerns or ideas.",The only challenge I can see is sometimes it is hard to remove the blockages but this happens in all business.,Recommends working here: Yes,Rates salary as: Average,4 years ago,"Brisbane CBD, Queensland, Australia",4.0,5.0,4.0,4.0,4.0,4.0,5.0,Suncorp
"‘Wonderful 8.5 yearswith total support, just not my direction anymore’",Call Centre Operator,"Always looking for best approach, very positive Employer, I had some major Crisis in my life and they Leaders and staff were right there for me","The Technology - keeping up with all the new trends and products - always a lot to learn - very phone based so not a great deal of time between calls at peak times. High turn around due to lots of staff movement upwards missed friendships made.
Need for Sales background helps",Recommends working here: Yes,Rates salary as: Average,4 years ago,,4.0,5.0,5.0,5.0,5.0,5.0,5.0,Suncorp
‘Overall experience is not bad and better than many others out there but they really battle with the things that should be a no-brainer for a company of this size’,Team Leader,"Lots of flexibility allows for great work life balance
Lots of really great people work there
They almost always seem to want to try and do the right things by the customer, they just don't always go about it in a way that makes sense to the people at the forefront of customer service.","Constant change and upheaval, continually trying to reinvent processes that aren't broken while ignoring ones that are. 
HR has pretty much all been off-shored, so dealing with them is not a great experience, as is the case with the IT help desk.
Constantly seem to be under-resourced, no matter what department you work in.
KRA's are constantly changing too and fail to motivate individual performance.",Recommends working here: Yes,Rates salary as: Average,4 years ago,"Brisbane, Queensland, Australia",3.0,5.0,2.0,3.0,3.0,4.0,3.0,Suncorp
"‘Supportive and understanding management, you will enjoy your time at Suncorp ’",Claims Administration Officer,"Suncorp was fantastic to work for, I was hired full time but asked if I could drop a day for my uni studies and they were more than happy to work around me. The management is incredibly thoughtful and understanding of having a work/life balance. They also provide excellent training around their products and services. You go in prepared and with a lot of support. The targets are also achievable and if they see you struggling they want to actually help you! In previous workplaces with targets that I hadn’t hit management took that as an opportunity to put me down but not at Suncorp. They created an action plan straight away and assigned a trainer to me that I could talk to and questions to improve conversations to meet targets. ",The job itself could get very boring. You’re essentially just asking set questions and filling out a response. Felt very mundane and autonomous after the first month. If you don’t want to think too hard about your job it’s a good role but I like something with more challenges. ,Recommends working here: Yes,Rates salary as: High,6 months ago,"Toowoomba QLD, Australia",3.0,5.0,5.0,5.0,4.0,5.0,5.0,Suncorp
‘Didn't have to work (or think) too hard but the work became boring and managment intolerable after a few years.’,Financial Adviser,You can largely make your own hours and the work is fairly straight forward so provides a good work option for those looking to be a financial planner without having to think too much or work too hard. All of the systems are provided and in most cases the leads to prospective clients are too. Very good option for someone starting out in this career.,"If you have ever worked in a bank in any role you already know the answer!!! While the systems are complete and thorough they provide no scope to think and once you evolve beyond basic skills these same systems will typically frustrate you. Further to this issue, banks have a special ability to employ and then promote people who are one part narcissistic and one part incompetent. While not everyone in management is like this you will undoubtedly get exposure to at least a few of these characters during your tenure. Again, you won't mind if your new to the career or job but it will typically frustrate people over time",Recommends working here: No,Rates salary as: Average,4 years ago,"Brisbane, Queensland, Australia",2.0,4.0,2.0,1.0,3.0,4.0,3.0,Suncorp
"‘Fast paced journey through knowledge, career progression and long lasting relationships professionally’",Client Manager,"Diversified culture, great range of careers progression opportunities the company highly puts your career progression at the forefront of everything you do right from the start. Suncorp will assist you with where you want to go and prove the right steps to help you achieve this.",The company is quite large it can be hard to become noticed or acknowledged for your achievements and work. Company structure due to the size of the company it is very volatile and changes quite often which can lead you with uncertainty of responsibilities or job security.,Recommends working here: Yes,Rates salary as: High,4 years ago,"Brisbane, Queensland, Australia",5.0,5.0,5.0,5.0,4.0,5.0,5.0,Suncorp
‘Management are on a swift course in halving the size of the Bank's balance sheet and destroying the profit and they actually think they know what they are doing!’,Branch Manager,A good job spoilt by really bad management. They just don't have a clue about Client relationships and how to grow a business Senior management have never been through a recession and are trying to grow a business with less staff after a far reaching restructure that has destroyed the culture.,Getting management to understand reality and business fundamentals is impossible. Rather than growing the pie they want to cut costs. That's what happens when you have a small minded accountant as Bank CEO.,Recommends working here: No,Rates salary as: Average,4 years ago,"NSW, Australia",2.0,2.0,1.0,1.0,3.0,3.0,1.0,Suncorp
‘Numerous roles and opportunities.’,Marketing Specialist,Plenty of opportunity to move around different lines of business and do secondments. Great flexible work life balance and work from home options. Excellent parental leave and 'flexible leave'.,"Flexible way of working means you don't have a desk - sometimes can't even find one to work at! Depending on which department you're in there can be challenges eg. Some managers are not open to part time workers, even though company policy is. Big company undergoing change = constant restructures and role changes. Definitely not a company for someone wanting one role for 2 years +",Recommends working here: Yes,Rates salary as: Average,4 years ago,"Brisbane, Queensland, Australia",5.0,5.0,3.0,4.0,4.0,4.0,4.0,Suncorp
‘A company that cares is one worth staying with.’,Sales And Service Banking Consultant,Suncorp Bank is a financial institution with big bank capabilities but with a focus on down to earth customer service and a community based attitude. It is a company that thrives on showing great care to its clients and that definitely spills over to its employees as well.,As Suncorp is still an institution that is predominately based in Queensland it can seem to be difficult for employment advancement interstate but as Suncorp continues to grow and expand to become the fifth largest in the whole country these opportunities will continue to grow as well,Recommends working here: Yes,Rates salary as: Average,4 years ago,"Ballina, New South Wales, Australia",5.0,5.0,4.0,4.0,5.0,5.0,5.0,Suncorp
‘Life Changing in a negative way.’,Financial Planner,"The staff are the best bit of the organisation, it’s just a shame that management don’t realise that the staff are the company’s greatest strength.","Lack of resources, staff resigning and not getting replaced ensure that stress levels are high and satisfaction levels are low.",Recommends working here: No,Rates salary as: Average,1 year ago,"Toowoomba QLD, Australia",2.0,1.0,1.0,1.0,4.0,3.0,1.0,Suncorp
"‘Great line managers, unfortunately, not so Agile anymore.’",Manager,I had incredible line managers at Suncorp who genuinely supported me when it mattered. The types of projects were varied and interesting. The Sydney office is in a great area.,"For a company well regarded for being Agile leaders, a restructure without any change management has enabled waterfall advocates to attain positions of influence. Unfortunately, this had a negative impact on my time there as these managers didn't receive feedback well, often not listening to it at all, and then blaming the teams when things didn't work well.",Recommends working here: Yes,Rates salary as: Low,1 year ago,"Sydney NSW, Australia",4.0,4.0,4.0,5.0,2.0,4.0,4.0,Suncorp
‘Lack inspiration.’,Enabling Function Leader,Colleagues and peers are great. Highly flexible working environment. Strong sense of pride in supporting the community.,"Was a great place to work but the current leadership has overworked the team and has too many initiatives on the go to really complete any of them. Little to no support from HR on training, pay, and progression.",Recommends working here: No,Rates salary as: Average,2 years ago,"Brisbane, Queensland, Australia",1.0,3.0,3.0,2.0,2.0,3.0,2.0,Suncorp
"‘I had such high hopes, and was completely dissapointed.’",Corporate Affairs,1 day work from home.,"Management very moody, most likely due to being overworked. I dreaded going to work because of the negative atmosphere. You'd think that working for a bank would produce decent budgets for projects... but this has been the \""tightest\"" company I have ever worked for. Suncorp's shareholders may be interested in knowing that they just shed 20% of their workforce every 18 months or so, so that the numbers look better on paper, which has seen a much larger turnover of staff and an awful working environment due to unmanageable workloads.",Recommends working here: No,Rates salary as: Average,2 years ago,"Brisbane City QLD, Australia",2.0,3.0,1.0,1.0,2.0,2.0,2.0,Suncorp
‘Hard to balance work/life with call centre roles’,Insurance Specialist,Working from home and working for a company people trust,"Lack of flexibility in changing work hours. Roster development difficult.
Late nights and weekends hard for family life.
Not great salary for the sacrifice of family life
Management heavy
Very results driven
Sales and service is actually sales",Recommends working here: No,Rates salary as: Low,6 months ago,"Brisbane QLD, Australia",3.0,2.0,3.0,3.0,3.0,5.0,3.0,Suncorp
‘A great experience once that I have no regret !’,Insurance Claims Specialist,"You get paid for the work and effort you put in. Anyone who is looking to advance their career in banking, finance and insurance would see this place as a pot of opportunities. There are plenty of chances and opportunities to advance your career and the people are great !",Being in customer service can be a challenge but Suncorp ensures that we are well trained to handle all types of situation and put the customer first!,Recommends working here: Yes,Rates salary as: Average,4 years ago,"Adelaide, South Australia, Australia",5.0,5.0,5.0,5.0,5.0,5.0,5.0,Suncorp
‘Regrettably wishing I wasn't fooled by great salary.’,CMO,"The employee benefits and perks are phenomenal. Great discounts. Great offers.
Salaries are high to compensate high staff turn over. Staff parties are unreal! They spare NO expense on parties. 
Annual company updates are held to provide all staff with progress and successes of company throughout the year.","Very high employee turn over due to poor management. Work/life balance is non existent which is a shame as it's a company motto. If you are an employee that works hard, wants to improve policies/procedures as they arise, have a passion to improve issues as they arise,  this is not the place for you. Unfortunately the culture here is; \""do as I say...not as I do\"" and is very much for those \""doormat\"" style workers.",Recommends working here: No,Rates salary as: High,4 years ago,"Sydney, New South Wales, Australia",2.0,1.0,1.0,1.0,5.0,1.0,2.0,Suncorp
"‘Used to be the best place I worked, but now it is a sad place.’",Administration Assistant,"Insurance discounts, good salary.","This used to be the most awesome place to work, but following the new CEO and almost complete turnover of  the senior leadership team, the organisation is not a good place to work. There is no positive culture, numerous restructures, lots of redundancies and cost cutting in the last 3 years, bad leadership and staff are no longer valued. Hopefully it will get better in the future, but many very good leaders have left the business.",Recommends working here: No,Rates salary as: High,1 year ago,"Brisbane City QLD, Australia",4.0,4.0,2.0,2.0,5.0,4.0,2.0,Suncorp
"‘Great support for work/life balance, but misses the mark in understanding employee struggles.’",Advisory Consultant,Very supportive of flexible working arrangements and work/life balance.,Too much middle management. Senior leadership team don't truly understand the challenges that th coal-face face everyday.,Recommends working here: Yes,Rates salary as: Average,6 months ago,"Adelaide SA, Australia",3.0,4.0,4.0,3.0,4.0,5.0,4.0,Suncorp
"‘While over the years I had some valuable experiences and learned much, the last few years were extremely stressful since the off shoring began.’",Policy Administration Officer,It is a large organisation and there are many departments. The company gives you 1 career day per year to try a different environment. You get 4 personal days per year to use as you wish. You are allowed 1 volunteer day per year to help a charity.,"The management style is very demeaning with little consideration of individual needs. Micromanagement is the norm and with the offshoring of many jobs, loyalty is a thing of the past. It is all about the money. There is no trust with management demanding a doctor's certificate for every sick day regardless. Job changes occur without explanation & or agreement. Opinions cannot be spoken without retribution.",Recommends working here: No,Rates salary as: Average,4 years ago,"Brisbane CBD, Queensland, Australia",2.0,3.0,1.0,1.0,3.0,1.0,3.0,Suncorp
