title,job_title,pros,cons,recommendation,salary,date,location,career_opportunity_rating,work_life_balance_rating,work_env_rating,management_rating,benefits_rating,diversity_rating,overall_rating,company
‘Would love to come back and work for the Suncorp Brand’,Motor Claims Consultant,"Great people, Relaxed but challenging environment. First class offices and work stations","Always more work to be getting on with, lots of departments to  improved your knowledge of insurance and claims.",Recommends working here: Yes,Rates salary as: Average,2 years ago,"Melbourne, Victoria, Australia",4.0,5.0,5.0,5.0,5.0,5.0,5.0,Suncorp
‘An amazing journey through banking to wealth management.’,Everyday Super Sales Consultant,Great work life balance and employee benefits. Many friendships made through working at suncorp.,Career development path.,Recommends working here: Yes,Rates salary as: Average,4 years ago,"Brisbane, Queensland, Australia",2.0,5.0,5.0,4.0,5.0,5.0,4.0,Suncorp
‘Great fun loving team I worked with’,Inbound Consultant,"My Team he was great, and the team I worked with was awesome.","Making sure our customer did not have to wait long, and giving a top services to them all.",Recommends working here: Yes,Rates salary as: Average,4 years ago,"QLD, Australia",4.0,4.0,5.0,5.0,4.0,5.0,4.0,Suncorp
‘Reasonable but could be so much better with solid leadership with a clear strategy. ’,Financial Planner,Staff are good to work with. ,Suncorp doesn’t have great direction as a bank Strategic direction was lead wanting. Brand as a bank was confused as to what it actual direction was. ,Recommends working here: No,Rates salary as: Low,6 months ago,"Townsville QLD, Australia",2.0,4.0,3.0,3.0,3.0,4.0,3.0,Suncorp
‘Good’,Insurance Consultant,"Good team
Environment",Different hours each week,Recommends working here: Yes,Rates salary as: Average,2 years ago,"Gosford, New South Wales, Australia",3.0,2.0,5.0,3.0,3.0,3.0,4.0,Suncorp
‘Never again!’,Consultant,"Fun atmosphere, good staff members but let down by management and senior management.","Management, senior management, you must be a brown noser to get anywhere. Management are too busy inexperienced and have no idea of empathy, compassion or support",Recommends working here: No,Rates salary as: Low,2 years ago,"Adelaide, South Australia, Australia",1.0,2.0,1.0,1.0,2.0,1.0,1.0,Suncorp
‘The tell you work from home etc is available but it is not based on perfomance it is based on who is friends with who’,Sales And Service Specialist,Other employees are all friendly,"No functionality to have time off for family and understaffed. 
they promote work life balance but if you have time off for family etc you get penalized",Recommends working here: No,Rates salary as: Average,4 years ago,"Charlestown, New South Wales, Australia",1.0,1.0,3.0,1.0,2.0,1.0,2.0,Suncorp
‘For me the experience was toxic’,Superannuation Partnered Consultant,Trip to India to support our Indian Colleagues ,Lack of support from Team Leader/Management ,Recommends working here: No,Rates salary as: Average,6 months ago,"Sydney NSW, Australia",3.0,4.0,3.0,3.0,3.0,3.0,3.0,Suncorp
‘Worse company to work with’,Client Manager,Nothing is good in this company,"Mental pressure, no work life balance",Recommends working here: No,Rates salary as: Low,4 years ago,,2.0,1.0,1.0,1.0,2.0,1.0,1.0,Suncorp
‘Good times’,Dispute Resolution Officer,Work life balance was good.  I worked ftom home a couple of days a week.,The role was challenging.  Having to deal with upset people everyday.,Recommends working here: Yes,Rates salary as: High,4 years ago,"Melbourne, Victoria, Australia",5.0,5.0,4.0,4.0,5.0,5.0,5.0,Suncorp
‘Good company and great people.’,Claims Assist Consultant,"Flexible working hours. Quarterly bonuses. Different departments, opportunities to move around.",Repetitive and not all departments worked cohesively.,Recommends working here: Yes,Rates salary as: Low,4 years ago,"Melbourne, Victoria, Australia",4.0,4.0,4.0,4.0,4.0,4.0,4.0,Suncorp
"‘Decent 9-5 job, but not much opportunity to go beyond.’",Senior Software Developer,Most agile process I've seen in larger organisation in AUS.,Forced to pair ALL the time (even for checking email). Messy deployment setups.,Recommends working here: Yes,Rates salary as: Average,4 years ago,,3.0,4.0,2.0,2.0,3.0,3.0,3.0,Suncorp
‘Great work  environment’,Customer Service Operator,There is always  support,Removing the blockages,Recommends working here: Yes,Rates salary as: Average,4 years ago,"Melbourne, Victoria, Australia",4.0,5.0,5.0,5.0,5.0,5.0,5.0,Suncorp
‘A great company with the potential to focus more on employees’,Sales And Service Assistant,"Staff benefits
Colleagues
Computer systems
Close to home
Flexible working arrangements","Sales and service targets
Management
Moving forward within the group
Staffing levels",Recommends working here: No,Rates salary as: Low,4 years ago,"Campbelltown, New South Wales, Australia",3.0,5.0,3.0,2.0,5.0,5.0,3.0,Suncorp
‘It paid the bills for over 8 years but I wouldn’t do it again.’,Senior Sales And Service Consultant,In depth procedures available ,"Expectations are unrealistic, in achievable targets and limited opportunity available to progress",Recommends working here: No,Rates salary as: Average,6 months ago,"Townsville QLD, Australia",2.0,2.0,2.0,1.0,2.0,2.0,2.0,Suncorp
‘A positive challenge in a diversified work environment’,Claims Administrator,"Career development, employee perks, working flexibility",The multiple systems - however there is a project in place to rectify this,Recommends working here: Yes,Rates salary as: High,4 years ago,"Sydney, New South Wales, Australia",5.0,5.0,5.0,5.0,5.0,5.0,5.0,Suncorp
‘I’ve never been fearful of bosses until now ’,Customer Value Specialist,Making friends & getting to talk to all different types of customers ,Management were awful & if they don’t like you’ll they drive you out to quit ,Recommends working here: No,Rates salary as: Low,6 months ago,"Newcastle NSW, Australia",3.0,2.0,1.0,1.0,3.0,1.0,1.0,Suncorp
‘Suncorp is an organisation that is at least trying’,Consultant,"Some great great leaders, ability to work from home and benefits","Inconsistencies created by poor leadership, opportunities for some but not all",Recommends working here: Yes,Rates salary as: Average,2 years ago,"Brisbane City QLD, Australia",3.0,4.0,4.0,3.0,4.0,5.0,3.0,Suncorp
‘Easy job to slide through life in :)’,Technical Advisor,Flexible working arrangements. Suncorp has always accommodated my needs.,"The usual challenges, not enough resources for the amount of work. Certain Management cliques.",Recommends working here: Yes,Rates salary as: Average,4 years ago,"Brisbane, Queensland, Australia",4.0,5.0,4.0,3.0,4.0,3.0,4.0,Suncorp
"‘Challenging, yet rewarding.’",Regional Support Officer,"Culture, Employment condirions, employer support.","Leadership, development in certain areas.",Recommends working here: Yes,Rates salary as: Average,4 years ago,"Brisbane, Melbourne",5.0,4.0,4.0,3.0,4.0,5.0,4.0,Suncorp
‘Loved working there just the companies expectations for targets were too high’,Senior Cashier,Great staff to work with,Trying to obtain weekly targets in such a small town with the same customers,Recommends working here: Yes,Rates salary as: Average,2 years ago,"Coffs Harbour NSW, Australia",3.0,3.0,4.0,4.0,3.0,3.0,4.0,Suncorp
‘A great Queensland organisation’,Senior Pricing Analyst,A very friendly and open culture.,To be able to show the larger picture,Recommends working here: Yes,Rates salary as: Average,4 years ago,"Brisbane, Queensland, Australia",5.0,5.0,4.0,4.0,5.0,5.0,5.0,Suncorp
"‘The last 14years have had highs and lows,but overall it was brilliant thanks to all great team of people,I was working along side.’",Customer Service Officer,The benefits on your insurance..,Keeping on top of assessments/compliances whilst doing your day to day work.,Recommends working here: Yes,Rates salary as: Average,4 years ago,"Newcastle, New South Wales, Australia",5.0,4.0,5.0,4.0,5.0,5.0,5.0,Suncorp
"‘A bit average and I've got to say, company is really lagging/ not as progressive as what I would have liked. ’",Communications Manager,The flexibility to work from home one day a week. Corporate office at Barrangaroo.,"Office politics, culture a bit dated, budget challenges (i.e. travel restrictions, hiring freeze). Virtual teams - interstate...but can't necessarily travel. ",Recommends working here: No,Rates salary as: Average,1 year ago,"Barangaroo NSW, Australia",3.0,2.0,3.0,3.0,3.0,4.0,3.0,Suncorp
‘Awful’,Insurance Advisor,"Not much, not worth it",Constant changes every day,Recommends working here: No,Rates salary as: Average,2 years ago,"Sydney NSW, Australia",2.0,3.0,1.0,1.0,3.0,1.0,1.0,Suncorp
‘It was not a fair place to work with no experienced leadership’,Legacy Policies,"Lots of team time, and team meetings",Lack of leadership allowing staff to allocate work unfairly,Recommends working here: No,Rates salary as: Low,2 years ago,"Sydney, New South Wales, Australia",1.0,2.0,1.0,1.0,2.0,1.0,2.0,Suncorp
"‘Challenging, rewarding, not enough career progression though’",Business Insurance Consultant,"Competitive salary, good people, great work environment, friendly customers.","Progressing quickly to further career goals, work systems unstable at times.",Recommends working here: Yes,Rates salary as: Average,4 years ago,"Melbourne, Victoria, Australia",4.0,4.0,4.0,3.0,4.0,5.0,5.0,Suncorp
‘Time to leave Brisbane and look for more opportunities with better career development.’,Data Analyst,Flexibility. Salary.,People in the Brisbane head office are less receptive to outsiders and people with international experience. Brisbane is a big small-town after all. Sydney is much better,Recommends working here: Yes,Rates salary as: High,4 years ago,"Brisbane, Queensland, Australia",3.0,5.0,4.0,1.0,5.0,5.0,5.0,Suncorp
‘An environment where you can work autonomously and get great support from your company in obtaining results.’,Customer Value Specialist,Work life balance such as working from home,After hour work and some inconsistent scheduling of time plus delays in getting advancement.,Recommends working here: Yes,Rates salary as: Average,6 months ago,"Narre Warren VIC, Australia",5.0,5.0,5.0,5.0,4.0,5.0,5.0,Suncorp
‘It was good and then became bad.’,Sales & Service Assistant,The people you work with are good,Favouritism is big. No Work/life balance is bad. I was there for 11 yrs and for the most part it was good but the changes that are happening lately are not exactly for the better.,Recommends working here: No,Rates salary as: Average,2 years ago,"Townsville City, Queensland, Australia",3.0,1.0,3.0,3.0,4.0,4.0,3.0,Suncorp
‘This job gave me a mental breakdown. ’,Sales Consultant,Nothing. There was absolutely nothing good about working for Suncorp (AAMI insurance).,The job itself absolutely sucked. Extremely high sales targets.,Recommends working here: No,Rates salary as: Low,1 year ago,"Narre Warren VIC, Australia",1.0,1.0,1.0,1.0,1.0,1.0,1.0,Suncorp
‘Never working for them again.’,Full Time Employee,"The people i worked with were great, and the customers were understanding and passionate about the company.","However due to a poor management culture and unrealistic expectations as to what constituted 'necessary overtime' and a complete lack of work life balance, they were a nightmare to work for.",Recommends working here: No,Rates salary as: Average,4 years ago,"Melbourne, Victoria, Australia",2.0,1.0,3.0,1.0,1.0,3.0,1.0,Suncorp
‘Not good anymore’,HR Advisor,Flexible work arrangements and great offices in main cities.,"Lots of red tape and cumbersome processes hinder efficiency and frustrate people who want to do a good job. The once great culture has become one of indifference.
Management don't walk the talk.",Recommends working here: No,Rates salary as: High,1 year ago,"Sydney NSW, Australia",3.0,4.0,1.0,1.0,2.0,5.0,2.0,Suncorp
"‘Excellent culture in the AAMI days, more restructing to come in the near future.’",Management,"People, Work Life Balance, Flexi Days","Constant restructuring, no opportunity for advancement, unstable future and no job security.",Recommends working here: Yes,Rates salary as: Average,4 years ago,"Melbourne, Victoria, Australia",1.0,3.0,2.0,1.0,3.0,3.0,2.0,Suncorp
‘Learning new things’,Customer Service Representative,Being able to Work from home,Lack of communication,Recommends working here: Yes,Rates salary as: Average,2 years ago,"Melbourne, Victoria, Australia",4.0,4.0,4.0,4.0,5.0,4.0,4.0,Suncorp
‘They were good to work for but didn't offer much carer development’,Customer Sales And Service Consultant,"Staff
The experience",Career movement,Recommends working here: Yes,Rates salary as: Low,4 years ago,"Roma, Queensland, Australia",3.0,3.0,4.0,4.0,3.0,5.0,5.0,Suncorp
"‘Suncorp is a great employer to work for, enabling those that are ambitious to move ahead, and those that aren't to just work to their best.’",Claims Specialist,Variety of roles and the opportunity to take control of your career and learning. Lots of changes to benefit the customers.,The volume of insurance claims is subject to the weather !,Recommends working here: Yes,Rates salary as: Average,4 years ago,"Sydney, New South Wales, Australia",4.0,4.0,5.0,4.0,4.0,5.0,4.0,Suncorp
‘Great employer’,Sales & Service Consutlant,Working from home for my particular role,"Not a,idling everyday as I lie my job",Recommends working here: Yes,Rates salary as: Average,4 years ago,"Brisbane, Queensland, Australia",5.0,5.0,4.0,4.0,5.0,5.0,5.0,Suncorp
‘Good employer who support employees at award wages.’,Work At Home Sales And Services Consultant.,"Management, morale and engagement excellent. I worked part time from home in the call centre and was well supported.",Probably doing extra work outside of core hours just to keep on top of compliance requirements.,Recommends working here: Yes,Rates salary as: Average,2 years ago,"QLD, Australia",4.0,5.0,4.0,4.0,4.0,5.0,4.0,Suncorp
‘Best place I have worked so far ’,Client Manager,"Option to work from home, great people and management. Opportunities to develop. ","Work can be fast paced, but isn’t too much ",Recommends working here: Yes,Rates salary as: High,6 months ago,"Adelaide SA, Australia",5.0,5.0,5.0,5.0,5.0,5.0,5.0,Suncorp
‘Has its challenges however as a company is a good place to work ’,Banking Consultant,Can have a great work environment. Company has great perks for employees,Management promise the world and deliver nothing. Hiring both internal and external is a disjointed process. Constant internal structure changes create no stability in roles or management teams ,Recommends working here: Yes,Rates salary as: Average,6 months ago,"Brisbane QLD, Australia",3.0,3.0,4.0,1.0,5.0,5.0,3.0,Suncorp
‘Best company’,Home Sales Consultant,Everything ! The company really looks after their employees,The role was difficult due to it being a call centre,Recommends working here: Yes,Rates salary as: High,3 years ago,Carindale,5.0,5.0,5.0,5.0,5.0,5.0,5.0,Suncorp
"‘I enjoyed the experience for 2 years, but was thrown away after being used for that time. 
Mentally stressful position and would not recommend anyone go into the role. ’",Claims Adviser,Most of the Staff are friendly and will help at any turn. ,"The expectations required for the role, when there is no proper training. 
Putting everything into a job (working after hours ALOT) and giving the Claimants my all, only to be pushed aside due to not meeting exact targets.  I thought Workers Comp is about quality, not quantity!",Recommends working here: No,Rates salary as: High,6 months ago,"Charlestown NSW, Australia",4.0,2.0,4.0,3.0,3.0,4.0,3.0,Suncorp
‘Enjoyable’,Customer Service Representative,Pay was great. Training not bad. Flexible work environment.,Meeting unrealistic targets. Short staffed constantly. Micromanaged.,Recommends working here: Yes,Rates salary as: Average,2 years ago,"Cairns, Queensland, Australia",3.0,1.0,3.0,3.0,3.0,4.0,4.0,Suncorp
‘Overall it is a good company to work for.’,Officer,The culture is amazing and there are lots of career development opportunities ,The pay is mediocre and management can sometimes belittle you ,Recommends working here: Yes,Rates salary as: Average,6 months ago,"Brisbane QLD, Australia",4.0,4.0,4.0,4.0,3.0,4.0,4.0,Suncorp
‘Treat staff well both financially and personally’,System Advisor,"Great pay, perks and potential for progression. Personal development is highly encouraged.",Restructures and change of leaders is constant,Recommends working here: Yes,Rates salary as: High,3 years ago,Brisbane,5.0,4.0,4.0,3.0,5.0,5.0,5.0,Suncorp
‘Suncorp a flexible company with generous rewards and room to move’,Claims Assistant,"Very flexible, easy to move up, career opportunities, great benefits",The call centres can be quite micro managed.,Recommends working here: Yes,Rates salary as: High,4 years ago,"Brisbane, Queensland, Australia",5.0,5.0,3.0,3.0,5.0,5.0,5.0,Suncorp
"‘Great company, great people and love the work life balance.’",Concierge Officer,"People, flexibility, career development, work/life balance",None,Recommends working here: Yes,Rates salary as: High,4 years ago,"Brisbane, Queensland, Australia",5.0,5.0,5.0,5.0,5.0,5.0,5.0,Suncorp
"‘People are great, work is interesting with great variety but difficult to get rewarded for the hard work you put in.’",Partnering Officer,Great work life balance. Interesting projects and talented people.,To be rewarded with greater pay for the work that you do. It is difficult to get decent pay rises.,Recommends working here: Yes,Rates salary as: Average,4 years ago,"Brisbane, Queensland, Australia",3.0,5.0,4.0,3.0,3.0,5.0,4.0,Suncorp
‘A positive culture with care at it’s core. ’,Human Resources Business Partner,Flexibility and a strong customer focus. ,"Tight resourcing in support areas.
Limited career development ",Recommends working here: Yes,Rates salary as: Average,6 months ago,Australia,3.0,4.0,4.0,4.0,3.0,4.0,4.0,Suncorp
‘Ridiculous’,Client Manager,They do give money to charity,"The management are a completely useless. 
They are not interested in making improvements, they don't listen, and the only way to get ahead is to sleep your way to the top.",Recommends working here: No,Rates salary as: Low,4 years ago,"Sydney, New South Wales, Australia",1.0,1.0,1.0,1.0,1.0,1.0,2.0,Suncorp
‘Very isolating working at home’,Calum’s Consultant,Building rapport with customers,Trying to reach KPI’s are stressful,Recommends working here: No,Rates salary as: Average,6 months ago,"Melbourne VIC, Australia",3.0,3.0,3.0,3.0,3.0,3.0,3.0,Suncorp
‘Redundancy was a blessing in disguise’,Sales And Service Assistant,"Enjoyed the work I did with my customers. Can be a great place to work if you get a good team, alternatively its just a toxic workplace with a lot of childish behaviour.","Multiple closures and redundancies. If you want to be treated like a person and not as a number,  work somewhere else.",Recommends working here: No,Rates salary as: Low,1 year ago,"Bundaberg QLD, Australia",3.0,4.0,1.0,1.0,5.0,3.0,2.0,Suncorp
‘Feel under valued and under appreciated’,Total Loss Claims,Discounts on insurance. ,Lack of career development focus. Management are Stats focused and push you to be like robots. Also below average pay compared to the competition.,Recommends working here: Yes,Rates salary as: Low,6 months ago,"Toowoomba QLD, Australia",3.0,3.0,1.0,1.0,4.0,4.0,3.0,Suncorp
‘More positive than negative’,Investigations Officer,"Very chilled workplace, great work/life balance, good people","Management, as with every company, can be completely out of touch with their employees and customer base",Recommends working here: Yes,Rates salary as: High,1 year ago,"Melbourne VIC, Australia",4.0,5.0,4.0,4.0,4.0,5.0,4.0,Suncorp
‘Gòod overall’,Executive Assistant,The people are great,So many mgmt changes,Recommends working here: Yes,Rates salary as: Average,1 year ago,"Melbourne VIC, Australia",3.0,3.0,3.0,3.0,4.0,4.0,4.0,Suncorp
"‘Such a lost company with very fuzzy direction, upper management leaving like a sinking ship’",Branch Manager,Work life Balance is the best aspect with no weekend commitments in Branches.,"Very limited support and resourcing, more jobs go and expectation that the void just gets filled with what is remaining.",Recommends working here: No,Rates salary as: Average,1 year ago,"Brisbane QLD, Australia",2.0,4.0,2.0,2.0,4.0,2.0,3.0,Suncorp
‘No Progression ’,Customer Value Specialist,"Friendly environment 
","After almost two years I reached my limit, understaffed at most times, when you are sick you are still expected to meet KPI's, wages were low, no signs of career progression, after having resigned there was some weird policy in place where they would not be able to reference you, that was a kick in the back side",Recommends working here: No,Rates salary as: Low,6 months ago,"Gisborne VIC, Australia",1.0,3.0,5.0,3.0,3.0,5.0,2.0,Suncorp
‘Working for this company is not recommended as significant staff turnover due to poor management and decisions.’,Sales Role,The customers were the best part.,Dealing with management and their attitudes.  Low levels of communication and little or no support.,Recommends working here: No,Rates salary as: Average,6 months ago,Australia,1.0,1.0,1.0,1.0,2.0,2.0,1.0,Suncorp
‘Great experience and still keep in touch with people that still work there’,Recruitment Consultant,Great working environment,Nothing,Recommends working here: Yes,Rates salary as: High,4 years ago,,4.0,4.0,4.0,5.0,4.0,4.0,5.0,Suncorp
‘Best of the 4 Banks I've worked for!!’,Lending Manager,Service focused culture. Stable senior management. Motivated staff.,Systems/processes need upgrading so workflow can be effectively managed.,Recommends working here: Yes,Rates salary as: Average,4 years ago,"Sippy Downs, Queensland, Australia",4.0,4.0,5.0,5.0,4.0,5.0,4.0,Suncorp
‘Great company to work for.’,Sales And Service Consultant,Friendly teams to work with and support networks.,Training and development for new systems and sales targets,Recommends working here: Yes,Rates salary as: Average,4 years ago,"Kippa-Ring, Queensland, Australia",3.0,3.0,4.0,2.0,5.0,5.0,4.0,Suncorp
‘Continue to come back for contract work due to great culture’,Technical Writer,Good culture within the Group as a whole. Many people make friendships and connections that carry on outside of employment.,Manager accountability,Recommends working here: Yes,Rates salary as: Average,4 years ago,"Sydney, New South Wales, Australia",5.0,5.0,4.0,3.0,4.0,5.0,4.0,Suncorp
‘Great working environment’,Business Outcome Advisor,Work and home balance,Some set structures are out of date,Recommends working here: Yes,Rates salary as: Average,4 years ago,"Sydney, New South Wales, Australia",4.0,5.0,4.0,4.0,5.0,5.0,5.0,Suncorp
‘Poorly managed and operated. Waste money to a degree unheard of.’,Claims,Flexibility within my role,Management run like a kindergarten. Lower to middle management do not support staff and upper management make little or no effort to touch base with the general staff. Rudderless ship of staff focussed only on numbers stats and graphs that do not reflect the real world. Set targets designed to fail and continue to go round in circles with methods that have been proven failures by previous management,Recommends working here: No,Rates salary as: Average,1 year ago,"Melbourne VIC, Australia",1.0,3.0,1.0,1.0,2.0,1.0,1.0,Suncorp
‘A great company to work for.’,Call Centre Operator,Continuous development opportunities,Adhering to a schedule and reaching certain targets,Recommends working here: Yes,Rates salary as: Average,4 years ago,"Toowoomba, Queensland, Australia",4.0,5.0,4.0,4.0,5.0,4.0,5.0,Suncorp
‘It has been exciting and supportive and rewarding.’,Work@home Sales And Service Consultant,Very forward thinking company determined to be the number one employer in Australia.,Always encouraged to go beyond your comfort zones.,Recommends working here: Yes,Rates salary as: High,4 years ago,"Brisbane, Queensland, Australia",5.0,5.0,5.0,5.0,5.0,5.0,5.0,Suncorp
‘Suncorp is one of the best companies to work for in Australia!!!’,Claims Officer,Suncorp makes you feel like part of a big family.  Management is genuinely concerned about each employee's well-being.  Flexible work arrangements mean that I can work from home permanently which is wonderful!!!,None.  If a challenge arises a solution is never far away.,Recommends working here: Yes,Rates salary as: Average,4 years ago,,5.0,5.0,5.0,5.0,5.0,5.0,5.0,Suncorp
‘Its been good but OK’,Insurance Customer Service Consultant,I enjoy the work and the people I work with.,Career progression. Feels like there is no where to go.,Recommends working here: Yes,Rates salary as: Average,6 months ago,"Brisbane QLD, Australia",2.0,3.0,3.0,2.0,4.0,5.0,3.0,Suncorp
‘Does not feel like a top company to work in’,Advisor,Flexible working and work-life balance,Career progress highly depends on who you follow. The culture is far from dynamic and constantly restructuring because senior management doesn't know where the company should head therefore has to restructure to create dynamics. KRAs are very poor designed.,Recommends working here: No,Rates salary as: Average,2 years ago,"Brisbane City, Queensland, Australia",1.0,4.0,1.0,1.0,3.0,3.0,1.0,Suncorp
