title,job_title,pros,cons,recommendation,salary,date,location,career_opportunity_rating,work_life_balance_rating,work_env_rating,management_rating,benefits_rating,diversity_rating,overall_rating,company
‘I came here to find a role that would give me exposure to lots of areas and people.  It's working perfectly’,Business Outcome Officer,"Working from home. 
Amazing benefits
Higher than market washes",Alot of people have been there for a long time.  It can be hard getting them to adjust to change,Recommends working here: Yes,Rates salary as: High,4 years ago,"Brisbane, Queensland, Australia",5.0,5.0,5.0,4.0,5.0,5.0,4.0,Suncorp
‘Very rewarding with varied challenges and benefits.’,Claims Manager,Work from home,Many but normal with every job.,Recommends working here: Yes,Rates salary as: Average,4 years ago,"Brisbane, Queensland, Australia",3.0,4.0,4.0,3.0,3.0,3.0,4.0,Suncorp
‘Enjoyed my time’,BDM,Good company to work for. Enjoy ed it,Nothing negative working there,Recommends working here: Yes,Rates salary as: High,4 years ago,"Sydney, New South Wales, Australia",4.0,4.0,4.0,4.0,4.0,4.0,5.0,Suncorp
‘In four years the job altered so much it was barely recognisable as the same position I started with.’,Claims Assist Consultant,Being encouraged to think of ways to improve the processes.,Having to work almost to a script and with inflexible time allowances.,Recommends working here: Yes,Rates salary as: Average,4 years ago,Melbourne,3.0,4.0,4.0,4.0,4.0,4.0,4.0,Suncorp
‘Good company to work with.’,Iteration Manager,Support Work life balance..,Poor project management,Recommends working here: Yes,Rates salary as: Average,3 years ago,Sydney,3.0,5.0,4.0,3.0,3.0,4.0,4.0,Suncorp
‘Bloody disappointing. Very happy to leave!’,Digital Content Manager,"Good immediate team, stifling management.  ",Fear based bureaucracy with too many people trying hard to prove their dominance rather than serve the customers ,Recommends working here: No,Rates salary as: High,6 months ago,"Brisbane QLD, Australia",1.0,2.0,1.0,1.0,2.0,5.0,1.0,Suncorp
"‘Low pay, high workload’",Operations Supervisor,The people you work with ,Lack of planning or direction and salary for majority under management is based on the competitive low for the field. ,Recommends working here: No,Rates salary as: Low,6 months ago,Australia,3.0,3.0,2.0,1.0,1.0,3.0,3.0,Suncorp
‘Too many hours of unrewarding work and too much change all the time’,Senior Project Accountant,Some smart people and decent salary,No work life balance and constant change and restructuring and off shoring,Recommends working here: No,Rates salary as: High,4 years ago,,3.0,1.0,3.0,3.0,3.0,3.0,3.0,Suncorp
‘Micro managed to meet sales targets regardless of customers needs’,Customer Service Representative,"Customers , staff and hours",Working conditions and expectations ,Recommends working here: No,Rates salary as: Average,1 year ago,"Cairns QLD, Australia",2.0,1.0,2.0,2.0,2.0,2.0,2.0,Suncorp
"‘Very poor training no support. Big talk, no action.’",Sales And Service Consultant,The people on the ground are excellent,"Technology is abysmal, no support network",Recommends working here: No,Rates salary as: Low,1 year ago,"Brisbane QLD, Australia",1.0,1.0,2.0,3.0,2.0,2.0,2.0,Suncorp
"‘I loved working for Suncorp, the people and atmosphere are great’",Insurance Claims,"Great people to work with 
Flexible work 
Career opportunities and support",Sometimes understanding current direction - multiple messages,Recommends working here: Yes,Rates salary as: High,1 year ago,"Sydney NSW, Australia",5.0,5.0,4.0,4.0,5.0,5.0,5.0,Suncorp
‘Stressful and depressing ’,Motor Assessor,"The great thing is when you are good at your job, you also get to do everyone else’s job for the same pay.. ",Dealing with the backlash from partners and customers who are ill informed and enforcing guidelines set by people with no actual hands on experience and are only driven by financial gain. ,Recommends working here: No,Rates salary as: Average,1 year ago,"Bella Vista NSW, Australia",2.0,1.0,2.0,2.0,3.0,1.0,2.0,Suncorp
‘No opportunities given to staff.’,Software Enigeer,It's easy to commute as the office Is located in the city.,They have good Good company Moto but it is just Moto.,Recommends working here: No,Rates salary as: Average,4 years ago,,1.0,1.0,1.0,1.0,1.0,1.0,1.0,Suncorp
‘Best working environment.’,Switchboard Operator,Suncorp cares not only for it's customers but it's staff also.,I haven't had any challenges that were negative.,Recommends working here: Yes,Rates salary as: Average,2 years ago,"Melbourne VIC, Australia",5.0,5.0,5.0,5.0,5.0,5.0,5.0,Suncorp
‘Great stuff’,Sales And Service Consultant,"Good atmosphere, great training, good people",Customers can be difficult but the support is great,Recommends working here: Yes,Rates salary as: High,4 years ago,"Toowoomba, Queensland, Australia",4.0,4.0,5.0,5.0,5.0,5.0,5.0,Suncorp
‘First years were good but it got worse & worse’,Banking Consultanr,"Friendly staff, some minimal discounts on certain banking & insurance products",Being comfortable with outbound cold calling,Recommends working here: No,Rates salary as: Average,4 years ago,"Port Macquarie, New South Wales, Australia",2.0,2.0,1.0,1.0,3.0,1.0,1.0,Suncorp
‘Was OK’,Customer Value Specialist,"Great colleagues, some great TLs,","Biased senior management, unrealistic targets, too much sales pressure,",Recommends working here: Yes,Rates salary as: Low,2 years ago,"Adelaide SA, Australia",2.0,3.0,3.0,3.0,3.0,3.0,3.0,Suncorp
‘Good to work in and develop the career’,Software Engineer,"Diversity
work life balanced style","Poor business decision from the top
Management and business cycle block the agile practice",Recommends working here: Yes,Rates salary as: Average,6 months ago,"Melbourne VIC, Australia",5.0,5.0,5.0,3.0,4.0,5.0,4.0,Suncorp
‘Easy to work at but not very inspiring’,Business Banking,Flexible work arrangements,Systems and processes are terrible,Recommends working here: No,Rates salary as: Average,4 years ago,,2.0,4.0,1.0,3.0,4.0,3.0,3.0,Suncorp
‘Fantastic people and great environment.’,Lending Support Officer,The staff and Management made it great.,Being employed as a Temp and wanting to become permanent was extremely difficult.,Recommends working here: Yes,Rates salary as: Average,1 year ago,"Brisbane QLD, Australia",2.0,4.0,5.0,5.0,3.0,5.0,5.0,Suncorp
‘I’ve enjoyed the growth experience ’,Manager,"Working independently, challenged to think outside of the box, you own your job",Getting projects funded,Recommends working here: Yes,Rates salary as: High,1 year ago,"Brisbane QLD, Australia",4.0,5.0,5.0,5.0,5.0,5.0,5.0,Suncorp
‘Progressive market leading regional bank’,Relationship Manager,"Ability to implement ideas and marketing objectives.
Able to think outside the box.",Being a relative unknown brand in Western Australia limited attraction of new business.,Recommends working here: Yes,Rates salary as: Average,4 years ago,"Perth, Western Australia, Australia",3.0,4.0,4.0,4.0,3.0,5.0,4.0,Suncorp
‘I had good experience working for Suncorp.’,Adviser Services,Good opportunities for growth,Diversity and challenges in my current role.,Recommends working here: Yes,Rates salary as: Average,3 years ago,Sydney CBD,3.0,3.0,4.0,3.0,3.0,4.0,4.0,Suncorp
‘It went from bad to worse over 5yrs.’,Administration Assistant,"There are a couple of nice, understanding people",Working there everything is a challenge when management doesn't listen to your distress and you're treated like an automaton.,Recommends working here: No,Rates salary as: Average,4 years ago,,2.0,1.0,1.0,1.0,2.0,1.0,1.0,Suncorp
"‘Overworked, under appreciated.’",Personal Assistant,"Perks are great, flexibility is ok","Don't expect to be treated like a person, you're just a number.",Recommends working here: No,Rates salary as: Average,2 years ago,"Sydney, New South Wales, Australia",2.0,3.0,1.0,1.0,5.0,3.0,1.0,Suncorp
‘Great place to begin a career in financial services’,Analyst,"Work/life balance, variety of work",Opportunities for advancement,Recommends working here: Yes,Rates salary as: Average,4 years ago,"Brisbane, Queensland, Australia",4.0,5.0,5.0,4.0,4.0,4.0,4.0,Suncorp
‘Stepping stone into a better company.’,Financial Planner,"Not too many thing. Great brand that clients do like, but management don't make the most of it.",Convert a lazy culture into a high performance culture.,Recommends working here: No,Rates salary as: Low,4 years ago,,1.0,4.0,3.0,1.0,1.0,4.0,1.0,Suncorp
‘Not bad’,Customer Service Representative,Flexibility for front line staff,Lack of flexibility for senior roles,Recommends working here: Yes,Rates salary as: Average,4 years ago,"Sydney, New South Wales, Australia",4.0,4.0,3.0,3.0,3.0,5.0,4.0,Suncorp
‘Expect way too much for what they pay.’,Banking Consultant,Working hours,High pressure sales with basically no bonuses.,Recommends working here: No,Rates salary as: Low,4 years ago,"Brisbane, Queensland, Australia",4.0,5.0,3.0,1.0,1.0,4.0,3.0,Suncorp
‘A great place to work’,Sales Leader,We put people first was the motto & they definitely delivered on that.,My centre was relocated.,Recommends working here: Yes,Rates salary as: High,2 years ago,"Melbourne, Victoria, Australia",5.0,5.0,5.0,5.0,5.0,5.0,5.0,Suncorp
"‘Excellent - if opportunity arises, I would go back and work for the company.’",Procurement Specialist,"Great work/life balance, flexible and encouraging ",Internal processes can be cumbersome - like all companies,Recommends working here: Yes,Rates salary as: Average,6 months ago,"Sydney NSW, Australia",5.0,5.0,5.0,5.0,5.0,5.0,5.0,Suncorp
‘Large complete program of work which unfortunately eats risk for breakfast.’,Project Manager,"Challenges, complexity, scale.","Management, communication",Recommends working here: No,Rates salary as: Average,4 years ago,,2.0,4.0,4.0,1.0,1.0,3.0,3.0,Suncorp
‘Best job ive ever had’,Banking /lending /Internet Banking Consultant,Flexible work arrangements are perfect for mums,Meeting targets,Recommends working here: Yes,Rates salary as: Average,4 years ago,"Brisbane, Queensland, Australia",5.0,5.0,5.0,5.0,5.0,5.0,5.0,Suncorp
"‘If you can live through (survive) the organisational changes which occur constantly, it's a pretty good place.’",Partners And Innovation,"Work life flex, and great work mates.",Annual restructures!,Recommends working here: Yes,Rates salary as: Average,1 year ago,"Melbourne City, VIC, Australia",3.0,5.0,4.0,3.0,2.0,4.0,4.0,Suncorp
‘Wouldn't work their again. Very unsatisfying’,Team Leader,Woodley life balance was good,"Senior management were stifling.
Inconsist practices
No autonomy for mid level management",Recommends working here: No,Rates salary as: Average,4 years ago,"Sydney, New South Wales, Australia",2.0,3.0,1.0,1.0,2.0,1.0,1.0,Suncorp
‘Great company to work for and lots of avenues to explore for career advancement’,Senior Support Coach,Flexibility and career development.,The many tasks that must be completed within the role. I feel it holds people back from doing their job well as there is lots to do.,Recommends working here: Yes,Rates salary as: Average,4 years ago,,4.0,5.0,4.0,4.0,5.0,4.0,4.0,Suncorp
‘Great place to work with plenty of opportunity’,Executive Manager Performance Reporting,Things get done. Plenty of opportunities to move around. Some really good managers and mentors.,You can feel like a commodity. Sometimes change management is done well but there is often little opportunity to structure a job around your interests and talents.,Recommends working here: Yes,Rates salary as: Average,3 years ago,Brisbane,4.0,4.0,4.0,4.0,3.0,5.0,4.0,Suncorp
‘LIfe changing and Life shaping. Suncorp help set me on the right path.’,Sales And Service Consultant And Team Leader,"Many staff discounts, diverse work force and able to choose many entry points. Can work from home or in a contact centre. Lots of career opportunities and support. Incentives for consistent hard working people.",None really. The same challenges that all would find if not prepared to work hard.,Recommends working here: Yes,Rates salary as: High,4 years ago,"Brisbane, Queensland, Australia",4.0,5.0,4.0,4.0,5.0,5.0,5.0,Suncorp
"‘If you want to progress your career, start with Suncorp’",Client Manager,So many opportunities to move into new roles,Storm season! Things tend to get busy and customers tend to get more needy,Recommends working here: Yes,Rates salary as: High,2 years ago,"Barangaroo, New South Wales, Australia",5.0,4.0,4.0,4.0,5.0,5.0,5.0,Suncorp
‘Highly competitive and challenging environment’,Customer Value Specialist,Work life balance is defo one of the great  things Suncorp has to offer. Ability to work from home and career development opportunities are available.,Expectation set on you is really high in comparison to resources available to get the job done or to run the operation smoothly. Company is going thru a core banking system change which all the pain of working off an incomplete operating system has been pushed to the employees with no real discount on expectations.,Recommends working here: Yes,Rates salary as: Average,2 years ago,"Brisbane QLD, Australia",5.0,5.0,4.0,3.0,3.0,4.0,4.0,Suncorp
‘May be a good insurance company but a minor bank. More like a government department.’,EM Operations Equipment Finance & Debtor Finance,Financially reasonable but not reward for effort.,"Culture of non decision making
Beauracratic
No delegation for decisions
Indecisive 
A committee for everything. 
Strangled by over engineering. 
Poor leadership 
Strategy continually changing. 
Restructuring for the sake of it. 
Poor credit capability.",Recommends working here: No,Rates salary as: Average,2 years ago,"Brisbane City, Queensland, Australia",1.0,3.0,2.0,1.0,2.0,1.0,1.0,Suncorp
‘Good. I gained a lot of knowledge about insurance and also greatly enhanced my communicative skills whilst working there. ’,Sales Consultant,"Good working environment, flexible hours and paid for over time, weekends and public holidays. Good for career progression in Sales/ Insurance sectors. ",The KPIs and the daily volume of calls expected to answer. ,Recommends working here: Yes,Rates salary as: Average,6 months ago,"Gosford NSW, Australia",3.0,3.0,4.0,4.0,3.0,3.0,4.0,Suncorp
‘A mixture of a sense of achievement and a sense of frustration at the 'blockers'’,BI Solutions Advisor,Some areas had real commitment to improving outcomes for clients and staff,Much of the management was excessively top-down with little recognition of the contribution from lower down,Recommends working here: Yes,Rates salary as: Average,4 years ago,"Brisbane, Queensland, Australia",3.0,4.0,3.0,2.0,3.0,5.0,3.0,Suncorp
‘Challenging and fulfilling experience which is different every day’,Claims Assist,Working for such a big company is great and the work environment is amazing!! Team leaders try to keep moral up by doing team activities frequently,"Challenges are good too, we are currently doing competitions with other teams to try and get the best stats.",Recommends working here: Yes,Rates salary as: Average,4 years ago,"Sydney, New South Wales, Australia",3.0,3.0,3.0,3.0,4.0,5.0,4.0,Suncorp
‘I got my career start with AAMI/Suncorp and spent 12 years there’,Customer Service Representative,"Benefits 
Team members
Work life balance - flexible working arrangements","Leadership - its a bit of a \""jobs for mates\"" culture 
Unless willing to relocate to Eastern States not much room for career development",Recommends working here: Yes,Rates salary as: Average,1 year ago,"Adelaide SA, Australia",3.0,4.0,3.0,2.0,5.0,4.0,4.0,Suncorp
‘Overall great benefits and perks if you can survive the overall lack of direction and less than ideal approach to getting work done.’,Senior Analyst,"Benefits are great, generally speaking people are great to work with as well. Flexibility is incredible, really appreciative of that.","Strange direction from the prior senior management has derailed the company over the last few years, it feels like it's lost it's way. Many experienced staff have left during that time which makes it hard to get things done. The overall approach to how work is financed (speaking from a technical team) is counter-productive to good quality long term outcomes, too much is done quick and cheap.",Recommends working here: Yes,Rates salary as: High,6 months ago,"Brisbane QLD, Australia",5.0,5.0,4.0,2.0,5.0,5.0,3.0,Suncorp
‘Too many chefs in the kitchen causes chaos’,Claims Assist Consultant,"Location is good 
Training was good
System (claim centre/guide wire) good","Team leaders poor support
Unrealistic standards that do not reflect a happy work environment.
Team leaders jobs unclear which causes frustration to agents as they do not offer support when requested.",Recommends working here: No,Rates salary as: Average,4 years ago,"Sydney, New South Wales, Australia",4.0,3.0,2.0,2.0,3.0,4.0,3.0,Suncorp
"‘If you don’t get promoted after 2 years, don’t bother trying. ’",Investigations,Leaving to go home. Working from home. ,Having management tell you how to do your job when they literally have no idea how it’s done. Or business improvement people coming in and not listening and changing what’s not broke for us to just go back to how it’s always done. Just ask the people doing the grunt work .... not that hard to get real feedback ,Recommends working here: No,Rates salary as: Low,6 months ago,"Brisbane QLD, Australia",2.0,4.0,2.0,2.0,2.0,4.0,3.0,Suncorp
‘I enjoy my role and the people I work with’,Customer Service Role,Work from home optiom,"Finding a permanent position, currently a max term contractor",Recommends working here: Yes,Rates salary as: Average,1 year ago,"Barangaroo NSW, Australia",5.0,5.0,5.0,5.0,5.0,5.0,5.0,Suncorp
‘Great at first but less so in recent years as they became an organization that values only extroverts.’,Software Engineer,"Training courses and seminars encouraged.
Keeping up with latest tech and processes.
Flexible when personal time is needed.",Succeeding requires you to be doing presentations and ensuring you are well known.  Introverts not valued.,Recommends working here: Yes,Rates salary as: Average,4 years ago,"Brisbane, Queensland, Australia",5.0,5.0,5.0,3.0,4.0,5.0,4.0,Suncorp
‘First time I've enjoyed coming to work - every day!’,Senior Communications Advisor,Flexibility to work from home; purchase extra annual leave; take a career break and try something else; support and encouragement for mature aged workers,A lot of gen y employees. But I like the challenge and try to learn as much as possible from them.,Recommends working here: Yes,Rates salary as: High,4 years ago,"Brisbane, Queensland, Australia",5.0,5.0,5.0,5.0,5.0,5.0,5.0,Suncorp
‘Work is always full on as teams always low in staff management doesn’t care about staff and only show there face before any survey comes out pay is lowest in industry not worth the stress ’,Client Manager,Location is good and can work from home ,Always understaffed and pay is lower then retail ,Recommends working here: No,Rates salary as: Low,6 months ago,"Barangaroo NSW, Australia",3.0,3.0,2.0,2.0,2.0,2.0,2.0,Suncorp
‘Staff turnover is high.’,Software Engineer,Flexible work options.,"I joined because I heard Suncorp had a great culture, but later learned that culture has gone.  \""Inspire our people\"" is a principle and the leadership team talk with good marketing but these are hollow words. The actuality is strict deadlines, budgets, and rank and yank tactics. Cliques are numerous and protect themselves only.

If you need a short term gig and are an extrovert you may like it here but if you believe \""happy employees make happy customers\"" look elsewhere. The culture at Suncorp is \""happy customers make happy management\"".

Management should remember that employees are (sometimes) customers too.",Recommends working here: No,Rates salary as: Average,1 year ago,"Brisbane City QLD, Australia",2.0,3.0,3.0,1.0,2.0,1.0,2.0,Suncorp
‘It had it's ups and downs but overall a great place to work’,Customer Service Operator,The staff are all really lovely and you get a lot of career opportunities and benefits.,Dealing with the customers who are unhappy without the knowledge to help them due to a lack of information given from management and upper management.,Recommends working here: Yes,Rates salary as: Average,4 years ago,"Milton, Queensland, Australia",5.0,5.0,5.0,3.0,4.0,5.0,4.0,Suncorp
‘Typical big company mentality - make money above all else.’,Team Leader,Ability to move laterally or upskill in another area is always on offer; secondments galore; fantastic flexible work/life balance support,Management do not care about or listen to their people; every single Executive Manager and above I worked for cared more about themselves progressing up the food chain than what they do helping you in yours; consistency in pay across levels and divisions is woeful; constant restructures - you NEVER feel safe,Recommends working here: No,Rates salary as: Average,3 months ago,"Brisbane QLD, Australia",4.0,4.0,2.0,1.0,2.0,4.0,2.0,Suncorp
‘Great company however the people make and break it.’,Training Specialist,Great upper management and vision for the company. Lots of training available. Happy to help people move into different parts of the business to increase experience. Some benefits are amazing for work life balance.,Middle management are really bad at their roles. If they are recognized at being really bad they get shifted into another department. Systems are out of date and the new system they are introducing is a bit interesting.,Recommends working here: Yes,Rates salary as: Average,4 years ago,"Brisbane, Queensland, Australia",5.0,4.0,3.0,1.0,3.0,3.0,4.0,Suncorp
‘Traumatic’,Claims Advisor,"None all bad, there is really nothing good about the place at all and its a struggle every second","Management, poor support, no advancement, poor salary, targets unachievable, extra hours needed but nil compensation for additional time, hierarchy or pecking order, no work life balance, the worst experience ever.",Recommends working here: No,Rates salary as: Low,2 years ago,"Brisbane City QLD, Australia",1.0,1.0,1.0,1.0,1.0,1.0,1.0,Suncorp
‘Good company and good work life balance and great career progression’,Sales Coach,Great company to work for as they are one of the very few that offer work from home roles.,There really isnt any challenges as the company is all about development and there is always someone to support you,Recommends working here: Yes,Rates salary as: Average,3 years ago,Cbd,5.0,5.0,5.0,5.0,4.0,5.0,5.0,Suncorp
‘Good culture but not particularly sharp in addressing key issues facing the business’,Manager,Very friendly culture and flexible work arrangements,"Senior Management are not particularly good and it is reflected in lower staff engagement scores and serious business challenges not being faced.  
Endless large workshops with nothing being achieved.",Recommends working here: No,Rates salary as: High,6 months ago,"Melbourne VIC, Australia",3.0,3.0,2.0,1.0,4.0,5.0,3.0,Suncorp
‘Fantastic’,Lead Business Analyst,"Work life balance, and working from home just works.","Egulated industry, diversified teams",Recommends working here: Yes,Rates salary as: Average,6 months ago,"Brisbane QLD, Australia",3.0,5.0,5.0,5.0,3.0,4.0,5.0,Suncorp
‘Can be improve if management care’,Group Risk Administrator,Suncorp has several companies under the wings and they have good relationship with several companies to offer discount for the staff,IT and account which were outsource are not helpful within the company,Recommends working here: Yes,Rates salary as: Average,4 years ago,"Sydney, New South Wales, Australia",3.0,3.0,3.0,2.0,5.0,3.0,4.0,Suncorp
‘Put in the ground work and have the right attitude and you will succeed in this comoany’,Loans Accounting And Maintenance Officer,"Work from home, flexible hours, opportunities",None,Recommends working here: Yes,Rates salary as: Average,4 years ago,,5.0,5.0,4.0,4.0,5.0,5.0,5.0,Suncorp
‘It was reasonable overall.’,Solutions Consultant And Insurance Consultant,"Taxi vouchers, support from colleagues and team leaders.  I worked there for 5 years.",Getting time off the phones to do other things,Recommends working here: Yes,Rates salary as: Average,3 years ago,Melbourne CBD,3.0,5.0,3.0,1.0,3.0,5.0,3.0,Suncorp
‘.’,Banking Consultant,Friendly staff members,"Poor management 
Low pay
No career development",Recommends working here: No,Rates salary as: Low,2 years ago,"Booragoon, Western Australia, Australia",1.0,1.0,1.0,1.0,1.0,1.0,1.0,Suncorp
‘Call centre extraordinaire’,Claims Assist Consultant,Positive and encouraging corporate environment,Real worldfrustrations,Recommends working here: Yes,Rates salary as: Average,4 years ago,"Newcastle, New South Wales, Australia",4.0,3.0,3.0,4.0,3.0,3.0,4.0,Suncorp
‘Best place I have worked’,Personal Banking Manager,"Great team
Great staff
Challenging budgets
Team environment 
Great training","Meeting some budgets
Role plays 
Budgets not revised when economy is struggling",Recommends working here: Yes,Rates salary as: Average,2 years ago,"QLD, Australia",5.0,5.0,5.0,5.0,5.0,5.0,5.0,Suncorp
‘Great people and real challenges’,Executive Manager,Very progressive and vibrant,Constant restructures and retrenchments,Recommends working here: Yes,Rates salary as: Average,4 years ago,"Sydney, New South Wales, Australia",5.0,4.0,5.0,4.0,5.0,5.0,5.0,Suncorp
