title,job_title,pros,cons,recommendation,salary,date,location,career_opportunity_rating,work_life_balance_rating,work_env_rating,management_rating,benefits_rating,diversity_rating,overall_rating
"‘Awful, do not work here. ’",Taxation Consultant,Nice offices. Some good clients.,"Colleagues, managers, partners, some clients aren’t good. ",Recommends working here: No,Rates salary as: Low,2 months ago,"Brisbane QLD, Australia",1.0,1.0,1.0,1.0,1.0,1.0,1.0
‘Great experience with a well known brand’,Senior Associate,Challenging and exciting with equality,Long hours,Recommends working here: Yes,Rates salary as: Average,4 years ago,,5.0,4.0,4.0,4.0,3.0,5.0,4.0
‘Good place’,Consultant,Fair,Work hard,Recommends working here: Yes,Rates salary as: Average,4 years ago,,5.0,3.0,5.0,5.0,4.0,5.0,5.0
‘Generally they don't treat their staff very well.’,Marketing Manager,Good brand to work for and experience gained in a global organisation,Some challenging personalities at leadership level. IT systems were overly complex time consuming and frustrating.,Recommends working here: No,Rates salary as: Average,4 years ago,,2.0,2.0,3.0,3.0,3.0,3.0,2.0
‘It was a great experiences’,Assistant Assurance,We know lot of new things,All of the deadline and how to manage it,Recommends working here: Yes,Rates salary as: High,this month,"Western Australia, Australia",4.0,2.0,4.0,4.0,4.0,5.0,4.0
"‘Looks great from the outside and on your CV, but is just used as experience for most due to perpetuation of high turnover culture. ’",Advisory Consultant,"Nice view, flexibility depending on your engagement, hours are great for most juniors. ","Easy to be bored and lack purpose even with lots of work, lip service to things like culture which is actually very cold, clinical work space, lots of people who want to leave (which makes things very depressing). ",Recommends working here: No,Rates salary as: Low,2 months ago,"Sydney NSW, Australia",4.0,4.0,2.0,2.0,3.0,2.0,2.0
‘It was absolutely horrible.’,Executive Assistant,Meeting a variety of people from diverse backgrounds. ,"Micromanagement, little opportunity for progression unless you are a director of partner, constantly being told I need to change my personality, constant gossiping that has no relevance to the work at hand, not enough money for the hours put in. ",Recommends working here: No,Rates salary as: Low,a few days ago,"Australian Capital Territory, Australia",1.0,2.0,1.0,1.0,1.0,1.0,1.0
‘Good company to get experience in big project but worst working culture and management is non existant’,SAP Business Analyst,Get to work on bigger projects,Dealing with cheaper resources,Recommends working here: No,Rates salary as: Average,2 years ago,"Sydney, New South Wales, Australia",4.0,3.0,1.0,2.0,1.0,5.0,2.0
"‘Good opportunity to jump-start your career, but don't stay for too long if you want to continue doing delivery work and improving your technical skills.’",Cyber Security Consultant,"- Good soft skill development
- Good work/life balance","- Bad managers
- Toxic culture
- Unfulfilling work",Recommends working here: No,Rates salary as: Low,2 months ago,"Melbourne VIC, Australia",2.0,4.0,3.0,1.0,4.0,2.0,2.0
‘Great people but low pay’,Associate Director,"I’m in CBS the internal team, so I have great work life balance and excellent support for professional development",Growth opportunities are less and so is the pay,Recommends working here: Yes,Rates salary as: Low,2 months ago,"Sydney NSW, Australia",5.0,5.0,4.0,5.0,4.0,5.0,4.0
‘Wouldn't recommend anyone to join ’,Senior Auditor,Couldn't think of any,Have to work overtime everyday without any compensation. No assistance from managers whatsoever.,Recommends working here: No,Rates salary as: Low,2 months ago,"Melbourne VIC, Australia",2.0,1.0,2.0,1.0,1.0,1.0,1.0
‘Great organisation to work for if you have support and backing of a partner and team. ’,Manager,"Exposed to a wide variety of people, businesses, challenges and technology. ",Impossible to progress as a technical resource. ,Recommends working here: Yes,Rates salary as: Average,2 months ago,Australia,2.0,5.0,5.0,2.0,5.0,5.0,4.0
‘Enjoyable and challenging ’,External Auditor Senior,The staff morale and working environment is good.,Clients are always a challenge in an audit space.,Recommends working here: Yes,Rates salary as: Average,2 months ago,"Perth WA, Australia",4.0,3.0,4.0,3.0,3.0,4.0,4.0
"‘Learn, learn, learn’",Manager,"Working with intelligent people, the purpose of building a better working world","Dealing with local leadership, legacy tools and its limitations",Recommends working here: Yes,Rates salary as: Low,2 months ago,"Perth WA, Australia",3.0,2.0,3.0,3.0,2.0,3.0,3.0
‘Career promotion at a price of lower salaries and long hours at work’,Manager,"Nice teams, management, diversity ",Relatively low salaries and expectations being higher every year,Recommends working here: Yes,Rates salary as: Low,2 months ago,"Melbourne Victoria, Australie",4.0,2.0,4.0,4.0,2.0,4.0,4.0
‘Exceptional ’,Senior Consultant,"I love the opportunities, the work and the global diversity. Most of all though, I’m valued for my time and effort. ",We definitely work hard ,Recommends working here: Yes,Rates salary as: High,2 months ago,"Melbourne VIC, Australia",5.0,4.0,5.0,5.0,4.0,5.0,5.0
‘Enjoyed my time at EY and would go back if the right opportunity presented itself’,Associate Director Business Development,Great people and a great place to work,Difficult for someone in business development to get ahead,Recommends working here: Yes,Rates salary as: High,4 years ago,"Brisbane, Queensland, Australia",3.0,3.0,4.0,4.0,4.0,4.0,4.0
‘It is good place to work but needs to manage the politics as the hierarchy and bureaucracy could slowdown the career development ’,Manager,"Lots of learning opportunities, good client base",Political and difficult to grow,Recommends working here: Yes,Rates salary as: Average,1 year ago,"Sydney NSW, Australia",4.0,5.0,4.0,5.0,2.0,5.0,5.0
‘Pointless ’,Auditor,Nice office with view ,No direction from anyone ,Recommends working here: No,Rates salary as: Low,1 year ago,"Sydney NSW, Australia",1.0,1.0,1.0,1.0,1.0,1.0,1.0
‘Should have resigned 3 years earlier’,Director,Some interesting projects,The toxic leadership,Recommends working here: No,Rates salary as: Average,3 months ago,"Sydney NSW, Australia",1.0,1.0,1.0,1.0,1.0,2.0,1.0
‘Ageist organisation ’,Manager,Not much..the view from my office ,They didn't utilise me,Recommends working here: No,Rates salary as: Average,3 months ago,"Brisbane QLD, Australia",3.0,3.0,1.0,1.0,2.0,1.0,2.0
‘Horrible’,Manager,My peers and the friendships I gained,Directors and partners,Recommends working here: No,Rates salary as: Average,2 years ago,"Melbourne, Victoria, Australia",1.0,1.0,1.0,1.0,1.0,1.0,1.0
‘EY is home’,Senior Associate,The people are great and friendly,Huge volume of work.,Recommends working here: Yes,Rates salary as: High,4 years ago,,5.0,5.0,5.0,3.0,4.0,4.0,5.0
"‘Great people, great culture’",Manager,The people,Work life balance,Recommends working here: Yes,Rates salary as: Average,4 years ago,,4.0,4.0,4.0,4.0,3.0,3.0,5.0
‘Churn’,Account Director,Na,No team remote management managed via email,Recommends working here: No,Rates salary as: Average,4 years ago,,4.0,3.0,2.0,2.0,2.0,5.0,3.0
